Index,Name,Description,Category,Price,Stock,Color,Size
242,Pro Scanner Monitor Treadmill,Camera top leg seat provide source listen.,Team Sports,946,597,DeepSkyBlue,Large
243,Portable Camera Edge,Require build between system star.,Health & Wellness,919,477,DeepPink,50x70 cm
244,Projector,Seat nature factor rate kid fight available heavy.,Home Decor,585,152,LightSeaGreen,M
245,Rechargeable Watch Headphones Kettle,Strategy agent enjoy social everything.,Men's Clothing,656,848,Fuchsia,Extra Large
246,Portable Headphones Edge,Onto key war control together box.,"Accessories (Bags, Hats, Belts)",442,238,SandyBrown,XXL
247,Digital Camera Drone Fan Smart Compact Air,Window southern charge TV cell see face relate.,Fitness Equipment,806,177,BlueViolet,10x10 cm
248,Digital Projector Wireless Air Edge,These thing whose until election boy back.,Bedding & Bath,429,995,LightSkyBlue,L
249,Smart Fan Lamp Automatic Fast Lite,Use space fight hear walk school.,Camping & Hiking,653,662,LawnGreen,8x10 in
250,Microphone,Glass charge recognize friend.,Men's Clothing,787,223,CornflowerBlue,Extra Large
251,Eco Brush Blender Vacuum Automatic Ultra,Across ready land smile who development leg effect.,Home Decor,347,862,Chocolate,12x18 in
252,Ultra Clock Lock,Huge game environment pay world.,Laptops & Computers,931,252,DarkSalmon,XL
253,Clean Fan Eco Fast Max,Deal not human almost you grow dog need.,Smartphones,180,185,BlueViolet,30x40 cm
254,Fast Fan Go 360,Ask easy religious.,Smartwatches,847,940,PapayaWhip,XL
255,Scale,Reflect sense medical area Mrs return stock true.,Headphones & Earbuds,562,998,PaleGoldenRod,12x18 in
256,Compact Keyboard Go,Never role discover his bank interest.,Clothing & Apparel,595,223,DarkRed,50x70 cm
257,Digital Projector Oven Thermostat Advanced Eco Smart,Turn source take treatment find push.,Cleaning Supplies,380,767,Lavender,XL
258,Pro Speaker Powerbank Camera,Which society appear board free wear.,Smartphones,503,171,MediumTurquoise,8x10 in
259,Rechargeable Lamp Freezer,Commercial field natural recent population age case.,Makeup,476,915,Olive,Medium
260,Keyboard Toaster Monitor,Difference carry break close table close.,Laptops & Computers,662,209,SeaShell,100x200 mm
261,Wireless Webcam,Happen situation heavy deep catch.,Home & Kitchen,790,552,Tomato,8x10 in
262,Powerbank Brush Charger,Car role rock discussion third cultural.,Cycling,823,590,Beige,XL
263,Smart Camera Router Fan Go,Always enter exist bed.,Health & Wellness,9,287,Moccasin,100x200 mm
264,Rechargeable Phone Grill,School truth deep during.,Health & Wellness,405,583,IndianRed,100x200 mm
265,Kettle Brush Fan,Four home focus office everybody product week.,Office Supplies,789,309,DodgerBlue,XL
266,Digital Bicycle Mini Rechargeable Digital,Rather house participant when lead strategy among.,Books & Stationery,218,285,Turquoise,12x18 in
267,Rechargeable Thermostat Oven,Not school direction.,Clothing & Apparel,670,22,MistyRose,L
268,Advanced Phone Speaker Blender Compact,Edge summer brother.,Women's Clothing,508,693,LimeGreen,Medium
269,Premium Lamp Lamp Mini Prime,Board section rate million month.,Home & Kitchen,614,97,DarkSeaGreen,Small
270,Portable Microphone,Day government recently its live bit radio.,Fragrances,188,144,LimeGreen,100x200 mm
271,Ultra Thermostat Drone Heater Plus Smart Eco,Watch ten act agree determine.,Clothing & Apparel,866,994,AntiqueWhite,12x18 in
272,Mini Lamp Monitor,Player college ask various society seat manage.,Skincare,226,664,IndianRed,Extra Large
273,Smart Powerbank Cooker Iron Advanced Go Go,Cold occur fear probably analysis always.,Haircare,655,531,Orange,5x7 in
274,Fast Radio Smart,Two if enjoy hand.,Fragrances,534,59,MediumSeaGreen,50x70 cm
275,Compact Brush,Message particularly or pattern wife available term.,Automotive,684,11,LightCoral,30x40 cm
276,Smart Toaster Pro,Almost season case.,Headphones & Earbuds,405,256,PaleGreen,M
277,Eco Webcam Dock Heater Go,Wrong difficult husband measure.,Skincare,530,639,FireBrick,15x20 cm
278,Eco Scale Trimmer Grill Edge,Improve name hand third within fill position.,Clothing & Apparel,960,832,Ivory,8x10 in
279,Pro Mouse Treadmill Phone Eco Portable Compact,Ready fish early.,Fitness Equipment,334,708,PaleTurquoise,100x200 mm
280,Wireless Dock Router Webcam Mini,Accept technology sort day anyone such rule.,Camping & Hiking,472,760,Green,30x40 cm
281,Silent Charger,Other nation imagine prepare two.,Automotive,325,148,Bisque,8x10 in
282,Trimmer Stove,Involve attorney behavior prove nature short billion PM.,Makeup,307,241,SteelBlue,15x20 cm
283,Lock Charger,Technology oil fine last cause never focus before.,Automotive,206,486,Fuchsia,5x7 in
284,Light Headphones Tablet,Mission quite figure discussion appear.,Home & Kitchen,856,512,LightCoral,XS
285,Automatic Lock Ultra,Despite lay born ability issue more then Democrat.,Books & Stationery,994,746,CadetBlue,12x18 in
286,Mini Mouse Monitor Phone Plus Wireless Wireless,Prepare partner kitchen hair.,Home & Kitchen,193,868,LavenderBlush,50x70 cm
287,Rechargeable Watch Thermostat,North attack degree seven sea rate important.,Shoes & Footwear,296,867,NavajoWhite,XXL
288,Thermostat Drone Heater,Write add trip magazine part also war fine.,Smartwatches,738,159,CadetBlue,8x10 in
289,Eco Thermostat,Not board American.,"Accessories (Bags, Hats, Belts)",325,191,Tan,8x10 in
290,Treadmill Dock,Store scientist condition even force.,Headphones & Earbuds,957,413,GoldenRod,XXL
291,Heater Stove Scanner,Kind society begin education moment able enough.,Cleaning Supplies,812,762,Chartreuse,M
292,Compact Blender One,Dinner light reduce executive reduce.,Women's Clothing,831,614,Gray,XS
293,Charger Lamp,Record popular national particularly animal.,Women's Clothing,405,166,LightSalmon,Small
294,Premium Router Scanner,Best station himself fight product.,Automotive,55,837,DeepSkyBlue,XS
295,Smart Phone Iron Speakerphone Prime Pro,Little thus time.,Makeup,708,972,FireBrick,Small
296,Smart Freezer Powerbank Watch Pro Lite Plus,Allow expect special campaign million new eye.,Haircare,114,283,PaleVioletRed,XS
297,Radio,Goal minute civil.,Women's Clothing,865,80,LavenderBlush,S
298,Rechargeable Bicycle Prime,During you wonder look talk.,Home Decor,499,60,MediumSeaGreen,Large
299,Radio Stove Shaver,Citizen woman foot.,Women's Clothing,520,521,DodgerBlue,10x10 cm
300,Smart Dock,Less shake stock available policy ahead investment.,Furniture,913,432,SlateBlue,Small
301,Mouse Heater,Minute between car consider low.,Beauty & Personal Care,314,367,DeepSkyBlue,XS
302,Webcam Scooter,Young our price daughter box onto show.,Skincare,112,919,DarkSlateBlue,XXL
303,Eco Heater Monitor Sense Ultra Portable,Hard statement mouth factor visit.,Sports & Outdoors,442,686,MediumVioletRed,M
304,Mini Fridge Freezer Plus,Have several look mouth mouth seven.,Headphones & Earbuds,516,557,SaddleBrown,XS
305,Clean Webcam Ultra Go,Same current always tough tend individual him.,Women's Clothing,666,698,LightBlue,50x70 cm
306,Eco Charger Eco,Set doctor can lose however radio picture.,Furniture,20,653,LimeGreen,30x40 cm
307,Premium Mixer Vacuum Sense Premium X,Until certainly pretty about if stay.,"Accessories (Bags, Hats, Belts)",89,120,SpringGreen,XS
308,Smart Fridge Go,Job catch fast.,Shoes & Footwear,784,218,LightSeaGreen,Small
309,Premium Bicycle Wireless 360 Touch,Dinner national help goal Mrs.,Health & Wellness,978,349,BlanchedAlmond,Large
310,Scale Stove,Town bag sister TV.,Grooming Tools,362,201,LightPink,100x200 mm
311,Ultra Clock Drone Charger Prime,Another step fly well finally attorney.,Furniture,724,537,Salmon,M
312,Wireless Scooter Scale Cooler Smart Edge,Even best yeah.,Health & Wellness,449,457,Bisque,8x10 in
313,Smart Watch Tablet Printer,Beat form any be air.,Home Decor,632,110,LightSkyBlue,Medium
314,Ultra Iron Monitor Smart Eco Smart,Back they bank everyone.,Grooming Tools,568,157,Aqua,100x200 mm
315,Rechargeable Heater,Forget school marriage return so.,Men's Clothing,944,990,PeachPuff,100x200 mm
316,Ultra Radio Iron,Main possible add by these those.,Cleaning Supplies,604,321,CadetBlue,XXL
317,Silent Scale Portable 360 Pro,Force move industry case ahead born not majority.,Beauty & Personal Care,443,652,LimeGreen,Extra Large
318,Fast Thermostat Microphone Scooter Plus,Before develop especially east whatever.,Cleaning Supplies,817,8,LightGray,10x10 cm
319,Drone Heater Scanner,Break right who or them.,Books & Stationery,783,705,LightGray,10x10 cm
320,Eco Dock Trimmer,Somebody drop significant.,Men's Clothing,106,83,Coral,5x7 in
321,Charger,Social rather floor other.,Bedding & Bath,411,212,DarkOrchid,Small
322,Wireless Camera Touch,His might easy former over skill former.,Fragrances,68,188,SandyBrown,50x70 cm
323,Silent Clock Lock Lite Rechargeable Digital,Morning present team result future nice.,Health & Wellness,272,368,PapayaWhip,8x10 in
324,Smart Toaster Clock Monitor 360 Sense,Maintain professor attorney these he land financial.,Home Decor,773,821,DarkRed,100x200 mm
325,Eco Webcam Projector Lock,Remember teacher report former.,Cycling,49,740,Yellow,XL
326,Premium Powerbank Radio Lite Prime,Community official lawyer page stuff within.,Makeup,996,88,BlanchedAlmond,M
327,Mini Scale Treadmill,Change matter oil attorney value senior believe.,Cameras & Accessories,882,370,DeepPink,12x18 in
328,Advanced Scanner Drone Go Max,Color worry almost total nature pay.,Health & Wellness,932,666,FloralWhite,50x70 cm
329,Portable Drone Thermostat Headphones 360 Touch Max,Seat discussion computer south.,Home Decor,593,247,Khaki,30x40 cm
330,Rechargeable Shaver Drone Premium,Alone sing race past behavior music.,Automotive,206,562,LightGreen,S
331,Pro Mouse Mouse Router Lite Mini,Crime read camera her wife effect unit.,Automotive,246,471,GhostWhite,15x20 cm
332,Smart Projector,Goal security why article cut.,Bedding & Bath,374,609,Crimson,XL
333,Smart Oven Speaker Fan Clean Wireless,Democratic guess stock.,Clothing & Apparel,701,409,Moccasin,M
334,Automatic Trimmer Stove Smart Smart,Item culture thousand surface happy.,Clothing & Apparel,663,706,Cyan,50x70 cm
335,Digital Drone Eco Rechargeable,Religious statement service friend.,Home Decor,117,342,DarkGreen,100x200 mm
336,Mini Cooler Fan X,Itself similar standard loss religious herself total.,Smartwatches,916,675,SkyBlue,15x20 cm
337,Automatic Dock Mixer Router Mini,Bag apply example door specific standard.,Bedding & Bath,539,27,DarkOrchid,15x20 cm
338,Mini Drone Heater Scanner Premium Max Ultra,Decade billion professional plant.,Furniture,225,65,MediumOrchid,Large
339,Premium Watch Camera Go Premium,Third deal agency stay field movement drive reality.,Grooming Tools,599,248,DeepSkyBlue,S
340,Rechargeable Toaster Clock Monitor Prime Eco,Skin feeling beyond thought sell news.,Fishing & Hunting,858,87,PaleTurquoise,Medium
341,Tablet,Ahead official page truth phone.,Fishing & Hunting,840,444,Ivory,5x7 in
342,Fan Drone Monitor,Forget the wind dream class production writer.,Home Decor,365,885,Silver,L
343,Advanced Oven Speaker Fan,Fight statement still child simple despite.,Laptops & Computers,473,906,Navy,10x10 cm
344,Premium Scooter Bicycle Oven Smart Ultra,Attorney modern anything which.,Cycling,453,39,SeaGreen,5x7 in
345,Smart Phone Grill,News voice debate you cup war board.,Kids' Clothing,388,265,Plum,M
346,Clean Watch Microphone Microphone Mini Wireless Compact,Now go age tree staff hair word.,Books & Stationery,676,771,DarkKhaki,15x20 cm
347,Silent Cooker Mouse Bicycle,Just their rule positive become story.,Cycling,952,905,Peru,12x18 in
348,Trimmer Cooler,As husband cause high letter.,Headphones & Earbuds,292,242,Magenta,10x10 cm
349,Pro Speaker Router Lamp,Attorney defense car care big new Mr.,Kitchen Appliances,313,909,IndianRed,Small
350,Mini Drone Printer Portable Wireless Automatic,Red walk general sure.,Haircare,653,811,OrangeRed,Extra Large
351,Mini Radio Mixer Lite,Often specific free offer without office daughter.,Home & Kitchen,100,416,MediumTurquoise,Small
352,Mini Router Freezer Webcam Air Max Edge,General of per we air social half.,Books & Stationery,909,557,PaleVioletRed,8x10 in
353,Compact Phone Scooter,Oil end beat attorney factor.,Cycling,803,189,MidnightBlue,10x10 cm
354,Silent Mouse Radio Light,Southern institution world team argue girl friend heart.,Cameras & Accessories,957,993,RosyBrown,XXL
355,Wireless Clock Advanced Rechargeable,Significant resource great dark ability gun four task.,Cleaning Supplies,899,706,Gray,15x20 cm
356,Fridge,Back every manager station far determine.,Kitchen Appliances,529,80,Chartreuse,S
357,Clock Drone Charger,Trouble walk my short let anything.,Team Sports,489,987,LightSkyBlue,15x20 cm
358,Automatic Scooter Microphone Wireless Compact Smart,Popular hot none second will safe smile.,Cleaning Supplies,325,617,RoyalBlue,Small
359,Smart Vacuum Lite Rechargeable Prime,Figure remember notice simple wide summer natural ok.,Kids' Clothing,755,180,Navy,12x18 in
360,Advanced Mixer Vacuum Wireless,Pm position movement pattern point.,Furniture,32,305,Azure,Medium
361,Silent Powerbank Sense Compact Rechargeable,Future Mr let against boy.,Office Supplies,433,683,LightPink,L
362,Fan Drone Monitor,Listen offer alone understand hour do.,Smartphones,979,22,OrangeRed,Medium
363,Smart Lamp Freezer Prime Advanced Clean,Knowledge line citizen other do ready standard.,Cycling,643,138,YellowGreen,XS
364,Projector,Tough relationship sometimes west.,Books & Stationery,718,952,BlueViolet,10x10 cm
365,Digital Mixer Heater Wireless Rechargeable,Return partner system huge thought education stop series.,Grooming Tools,345,436,WhiteSmoke,8x10 in
366,Dock,Tonight reduce one deal space.,Beauty & Personal Care,944,444,FireBrick,15x20 cm
367,Rechargeable Brush Scanner Wireless Plus,Any later surface reach group run carry star.,Cleaning Supplies,776,681,Tomato,Small
368,Ultra Scale Toaster,Senior value financial night traditional contain.,Fishing & Hunting,75,292,MediumOrchid,XL
369,Smart Vacuum Iron Phone Pro,Foot bar sing billion.,Men's Clothing,337,375,Lavender,L
370,Advanced Webcam Cooker Toaster Smart,Light likely art pretty voice officer.,"Accessories (Bags, Hats, Belts)",533,496,Tomato,100x200 mm
371,Ultra Cooker 360 Eco Pro,Treat worry moment ahead station blood.,Smartphones,999,758,SeaGreen,L
372,Rechargeable Grill Trimmer Eco,Administration such tend interview summer.,"Accessories (Bags, Hats, Belts)",69,506,PowderBlue,10x10 cm
373,Advanced Powerbank Scooter Rechargeable Air,Brother should method contain strategy similar.,Kitchen Appliances,576,117,Pink,L
374,Mini Dock 360 One Premium,Bit evidence eight perform center.,Cycling,215,430,MediumPurple,Large
375,Advanced Radio Smart Compact One,Least every fill television catch.,Health & Wellness,301,991,DeepPink,15x20 cm
376,Premium Powerbank Scooter Rechargeable Edge Eco,When material together leg same fire.,Cycling,890,614,LemonChiffon,5x7 in
377,Portable Lock Blender,End become lead not reflect.,Makeup,290,893,MediumSeaGreen,50x70 cm
378,Watch,Which sign cold.,Laptops & Computers,369,332,DarkSlateGray,XXL
379,Clean Scooter Scale Cooler Portable Smart,Deep notice big election cause name.,Furniture,147,882,DarkCyan,Extra Large
380,Clean Powerbank Cooker Iron Lite,Whole service walk whether just.,Kitchen Appliances,685,394,SlateGray,15x20 cm
381,Phone Speaker Blender,Order within however well recognize shoulder.,Smartwatches,392,295,Lime,Extra Large
382,Clean Phone Speaker Blender Touch Wireless,Exactly strategy message recent home.,Haircare,988,991,Linen,12x18 in
383,Digital Treadmill Smart Edge Pro,Read moment prevent opportunity line public buy.,Grooming Tools,160,668,Sienna,Small
384,Portable Lamp One Prime One,Effect force trouble admit later certainly.,Cameras & Accessories,854,660,Black,M
385,Lock Freezer,Address region south become say.,Home Decor,296,466,SlateGray,M
386,Blender Cooker,Candidate health act institution hospital price management.,Health & Wellness,841,644,DarkViolet,5x7 in
387,Keyboard Freezer,Hit improve chance report middle perhaps wind worry.,Furniture,423,633,Gainsboro,XXL
388,Smart Clock Brush Prime,Parent vote property red economy.,Fragrances,761,506,Linen,100x200 mm
389,Advanced Kettle Plus,Rise article expert fill teach scene onto loss.,Smartphones,421,912,RoyalBlue,XXL
390,Wireless Radio Treadmill,Might exist who.,Shoes & Footwear,631,866,DarkSlateGray,50x70 cm
391,Wireless Speakerphone Eco Smart,Star thing ahead sort of majority sometimes.,Fragrances,123,993,OliveDrab,Large
392,Fast Clock Sense Go,Artist all spend quality voice finish place.,Kitchen Appliances,301,788,Purple,XL
393,Powerbank Brush Charger,Trouble hold south provide bed manage.,Health & Wellness,102,522,LightSkyBlue,8x10 in
394,Rechargeable Kettle Brush Fan Max,Hope feel compare ready.,Cycling,363,174,LawnGreen,Extra Large
395,Wireless Radio Smart Air Prime,Doctor easy pay wait rich would.,Skincare,206,998,PaleVioletRed,Extra Large
396,Charger Bicycle Fan,Deal ago onto else.,Haircare,276,843,DarkGoldenRod,S
397,Charger Lamp,Policy enjoy east certain safe there boy.,Cycling,38,380,Cyan,XS
398,Radio,Against stop heart about chance whom.,Kitchen Appliances,673,529,HotPink,Large
399,Smart Bicycle Speakerphone Printer,Central third assume go.,Home & Kitchen,878,837,Magenta,30x40 cm
400,Pro Headphones Monitor Rechargeable Pro Go,Skill career back lead according degree.,"Accessories (Bags, Hats, Belts)",624,404,Gainsboro,S
401,Fast Powerbank Mini Sense,Wait speech million point difficult travel.,Fishing & Hunting,770,303,Red,5x7 in
402,Digital Camera Drone Fan Digital Mini Rechargeable,Account cut company training.,Beauty & Personal Care,163,773,Azure,Small
403,Portable Mouse Rechargeable,Before list give director economy.,Men's Clothing,540,76,DarkGoldenRod,M
404,Wireless Scooter Advanced Plus,Write level avoid a.,Automotive,910,579,SpringGreen,30x40 cm
405,Grill Phone,Major around night spring.,Shoes & Footwear,551,776,GoldenRod,10x10 cm
406,Mini Cooler,Movement later occur wall hold professor simple century.,Cycling,201,214,Turquoise,M
407,Automatic Charger Lamp Ultra,Within along push score.,Haircare,322,836,Gold,L
408,Compact Microphone Lamp Speaker Clean Wireless,Source purpose street guess condition.,Haircare,383,717,Orchid,50x70 cm
409,Fast Cooler Sense Premium,Degree story simple force indeed finish better.,Kitchen Appliances,318,547,PaleGoldenRod,L
410,Rechargeable Cooler Vacuum Wireless Premium,Around us pressure address.,Books & Stationery,289,798,SaddleBrown,L
411,Compact Scanner Shaver Powerbank Advanced One Mini,Good build east down.,Home Decor,478,700,Moccasin,XXL
412,Portable Toaster Scanner,Down nothing spend fish.,Grooming Tools,721,171,RoyalBlue,12x18 in
413,Fast Shaver Mouse Lite Lite Plus,Thought month professional somebody daughter there grow.,Camping & Hiking,227,914,MediumAquaMarine,Small
414,Fast Heater Touch,Senior clear look mouth order million room.,Sports & Outdoors,460,903,PaleTurquoise,Medium
415,Portable Trimmer Stove One Premium,Role recent world not west Mr those.,Furniture,500,965,DarkSlateGray,10x10 cm
416,Smart Speakerphone Stove Tablet Advanced Wireless,Rise bit cut hard.,Haircare,610,744,Tan,XXL
417,Advanced Fan Thermostat Edge,Lead late light order understand peace event.,Cleaning Supplies,413,419,Violet,Large
418,Monitor,Third only word this.,Smartphones,812,659,PaleVioletRed,30x40 cm
419,Advanced Fridge Fan Lamp Ultra X,Fish explain increase next.,Home & Kitchen,474,950,Orchid,30x40 cm
420,Automatic Cooler Treadmill,Professional and prevent.,Laptops & Computers,840,634,DarkRed,XXL
421,Microphone Clock,Its its low keep policy notice maintain.,Health & Wellness,146,473,CornflowerBlue,100x200 mm
422,Ultra Vacuum,Front more season no nor region dark.,Toys & Games,287,644,Brown,5x7 in
423,Advanced Cooler Lite 360 Sense,Mind impact interview.,Men's Clothing,837,699,OldLace,30x40 cm
424,Grill,Laugh language think bag model.,Haircare,403,677,DarkOrchid,5x7 in
425,Heater,During anyone possible difference fund.,Beauty & Personal Care,601,320,ForestGreen,50x70 cm
426,Blender Blender,Loss manage participant into.,Fragrances,463,577,Yellow,XL
427,Smart Freezer Pro Digital Automatic,Itself type forward tend thus research.,Cameras & Accessories,560,285,MediumPurple,8x10 in
428,Advanced Webcam Printer Prime Portable Air,Cup start free author agency position.,Cameras & Accessories,489,605,Khaki,XXL
429,Portable Keyboard Freezer,Both south similar common believe.,Grooming Tools,544,790,SeaGreen,Large
430,Phone,Today near minute keep second.,Cycling,118,468,LightYellow,Large
431,Portable Dock Eco Eco Eco,Beat simply factor soon world.,Fishing & Hunting,21,565,LightSlateGray,5x7 in
432,Ultra Powerbank Brush Charger,Number cut least beautiful reduce.,Health & Wellness,560,552,Tomato,Extra Large
433,Brush Blender Vacuum,Network them way their station.,Automotive,229,39,DarkRed,100x200 mm
434,Rechargeable Heater Monitor Plus Prime,Place organization far probably stay.,Makeup,952,916,DimGray,L
435,Compact Toaster Light Monitor,Body shoulder worker local quality instead model.,Camping & Hiking,309,366,Olive,5x7 in
436,Ultra Blender Toaster Camera Plus Fast,Democratic year dark step institution huge throw.,Camping & Hiking,256,885,Gold,12x18 in
437,Silent Dock Mixer Router Edge,Research population score music hold soldier.,Toys & Games,805,273,Salmon,30x40 cm
438,Advanced Scanner Drone Premium Advanced,Human Democrat now technology movement air direction.,Smartphones,379,888,OrangeRed,XL
439,Automatic Keyboard Toaster Monitor Plus Smart Clean,Hand consumer condition guy mind.,Cleaning Supplies,668,90,BlueViolet,L
440,Pro Toaster Oven Sense Eco Mini,Leg people audience not leader person born.,Headphones & Earbuds,860,310,PowderBlue,100x200 mm
441,Wireless Keyboard Kettle,Treat close even page.,Skincare,160,241,Tan,M
442,Portable Vacuum Lite,Place star real international.,Kitchen Appliances,95,722,LightGoldenRodYellow,Extra Large
443,Clean Powerbank Clean Ultra 360,Once method me become need her manager.,Clothing & Apparel,688,340,MintCream,15x20 cm
444,Portable Headphones Air One Compact,Last child all so hear everyone run.,Makeup,297,157,Sienna,5x7 in
445,Digital Thermostat Iron Go,Station study sit bring dog body.,Home & Kitchen,852,920,GreenYellow,XS
446,Monitor Light,Dream once opportunity choice give class.,Home Decor,476,191,Silver,10x10 cm
447,Mini Printer Sense Prime Go,Finish though lot material.,Makeup,514,620,Azure,50x70 cm
448,Premium Headphones Portable,Inside option herself drive suddenly return unit.,Laptops & Computers,498,784,Crimson,M
449,Oven Scale,Upon deal on then minute remain.,Beauty & Personal Care,805,826,Indigo,100x200 mm
450,Automatic Headphones Stove X,List stop but chance activity.,Kids' Clothing,887,233,CadetBlue,8x10 in
451,Eco Brush,Data street consider lose everyone.,Women's Clothing,94,145,DarkOrange,10x10 cm
452,Digital Lamp Freezer Ultra 360 Pro,National protect question evening difficult.,Cycling,245,175,SkyBlue,Small
453,Wireless Phone 360 Mini,First exist investment available per cultural worry.,Clothing & Apparel,17,379,Ivory,10x10 cm
454,Smart Lock Bicycle Clean Touch,Big factor war trial.,Women's Clothing,670,565,FloralWhite,Large
455,Eco Keyboard Go Mini Silent,Job arm computer character author.,Cameras & Accessories,472,790,Snow,8x10 in
456,Dock,Reveal production anything contain.,Beauty & Personal Care,129,46,Turquoise,L
457,Smart Dock Trimmer,Memory themselves finally bit policy Mrs rise different.,Kitchen Appliances,172,748,DarkOrchid,Medium
458,Digital Headphones Monitor Premium Advanced,Dinner leader write.,Books & Stationery,382,595,BlueViolet,10x10 cm
459,Vacuum,Authority to better structure.,Fragrances,34,915,RosyBrown,8x10 in
460,Ultra Iron Digital Max,Music low including know strategy girl truth.,Books & Stationery,401,978,ForestGreen,Large
461,Keyboard,Sea it decision already better energy culture.,Kitchen Appliances,428,26,LightCoral,Small
462,Silent Powerbank Lite Plus Clean,Maybe democratic wait life.,Home Decor,89,99,Azure,XS
463,Smart Tablet Microphone Trimmer,Stage believe institution dream attorney sister.,Furniture,699,333,SeaGreen,50x70 cm
464,Silent Microphone,Walk marriage speech minute financial everything business.,Cleaning Supplies,328,186,LightPink,Extra Large
465,Wireless Bicycle Microphone Digital Portable,Plant matter leave language catch wish itself.,Haircare,631,192,BlueViolet,S
466,Automatic Scale Headphones,Prepare positive little price evening.,Camping & Hiking,625,747,Black,8x10 in
467,Fast Watch Microphone Microphone Smart Premium Portable,Paper third story contain star kind identify contain.,Makeup,258,386,DarkSalmon,5x7 in
468,Ultra Brush Touch Mini,Admit field language state result community.,Toys & Games,145,67,Olive,12x18 in
469,Trimmer Clock,Performance receive court tonight throughout when modern.,Automotive,879,367,Gainsboro,8x10 in
470,Smart Mouse Heater Clean Air,Away consider still election order.,Headphones & Earbuds,114,294,SeaGreen,15x20 cm
471,Automatic Webcam Scooter One Compact,A wrong because smile school enough.,Toys & Games,330,832,LightSteelBlue,Medium
472,Portable Camera Clean Premium,Camera service difference culture hold scientist nearly.,Home & Kitchen,746,934,MintCream,L
473,Smart Phone Thermostat Silent Go,Worker late simply open study.,Smartwatches,947,742,CadetBlue,Extra Large
474,Vacuum,Range education example evidence apply.,Women's Clothing,533,781,LemonChiffon,50x70 cm
475,Eco Iron Prime One Wireless,Worry exactly military drug detail whom play.,Sports & Outdoors,21,676,DarkSlateBlue,XS
476,Pro Speaker Keyboard Digital Touch Automatic,Director staff lawyer suddenly provide matter blood.,Sports & Outdoors,550,745,Salmon,M
477,Rechargeable Lock Charger,Season laugh commercial say.,Skincare,44,869,LightGreen,Large
