Index,Name,Description,Category,Price,Stock,Color,Size
1,Thermostat Drone Heater,Consumer approach woman us those star.,Kitchen Appliances,74,139,Orchid,Medium
2,Ultra Speaker Iron Grill Advanced One,Point suggest easy money operation could white.,Fitness Equipment,510,351,MediumSeaGreen,Small
3,Watch Headphones Kettle,Reach husband education.,Beauty & Personal Care,254,409,Lavender,XXL
4,Portable Toaster Clock Monitor Silent,Always choose school poor table main.,Makeup,69,119,Pink,XL
5,Pro Toaster Oven,Worry put discuss easy back too career.,Automotive,525,727,LightCoral,XL
6,Mini Speakerphone Mixer,Tell figure discussion chair red keep tough.,Team Sports,413,566,OliveDrab,Medium
7,Eco Cooler Printer Speaker Prime Prime,Cover close myself camera red evening.,Health & Wellness,621,245,Moccasin,Extra Large
8,Webcam Trimmer Projector,Fear fight until market court worry security trouble.,Laptops & Computers,414,559,HoneyDew,XL
9,Silent Headphones Stove Wireless Air Clean,Truth gun Democrat commercial.,Home & Kitchen,858,525,Chocolate,5x7 in
10,Wireless Charger Air Premium Ultra,Public security home.,Health & Wellness,153,550,MediumPurple,S
11,Portable Fan Monitor Toaster Pro Smart Air,Number create north effect deep third hard.,Health & Wellness,738,417,LightPink,12x18 in
12,Mini Iron Drone,Small meet inside career walk company.,Shoes & Footwear,367,511,WhiteSmoke,S
13,Smart Grill Tablet Fridge Sense,Eat describe discussion today.,Grooming Tools,867,679,SaddleBrown,XL
14,Portable Grill Air Edge,Probably someone several moment if.,Clothing & Apparel,356,904,DarkBlue,S
15,Premium Brush Scale Grill Plus Plus,Fire your stuff.,Smartwatches,439,987,MintCream,M
16,Vacuum Router Toaster,Work subject ten firm more price.,Team Sports,245,412,LightSeaGreen,L
17,Digital Clock Lock Eco Premium Portable,On ago smile stop.,Office Supplies,999,14,SeaShell,XL
18,Fast Watch Microphone Microphone,Behind home imagine enter think next whole cell.,Haircare,868,416,Fuchsia,M
19,Clean Dock Mixer Router,Democratic cost use air data push.,Toys & Games,411,202,Ivory,Large
20,Cooker Brush,Human office industry threat blue.,Headphones & Earbuds,280,124,Orchid,50x70 cm
21,Premium Cooler Premium Sense,Though knowledge hand.,"Accessories (Bags, Hats, Belts)",448,634,Magenta,M
22,Digital Powerbank Rechargeable Wireless,Few from outside role.,Health & Wellness,612,413,SkyBlue,S
23,Digital Drone Advanced,Send speech product member.,Clothing & Apparel,517,738,AliceBlue,Medium
24,Automatic Thermostat Drone Heater,Learn raise possible easy treatment.,Kitchen Appliances,182,86,Lavender,XL
25,Clean Webcam Powerbank Portable Compact,Investment ability bring recognize meeting husband guess.,Toys & Games,935,415,MediumVioletRed,S
26,Headphones,To even operation down.,Team Sports,35,527,Salmon,Large
27,Fan Iron Cooker,Body perhaps own south always common never.,Health & Wellness,926,848,SlateBlue,Large
28,Wireless Printer Fan Compact Plus,Network financial draw sport season push nation.,Home & Kitchen,934,479,SeaGreen,10x10 cm
29,Ultra Projector Rechargeable,Care environment stay might rock guess.,Books & Stationery,282,953,Khaki,S
30,Blender Toaster Camera,Great might hair occur certainly.,Books & Stationery,90,680,Sienna,Large
31,Treadmill,Role hotel test meeting probably reduce.,Toys & Games,537,646,DarkViolet,L
32,Portable Webcam Powerbank Rechargeable Advanced,Enter decade indicate.,Fitness Equipment,177,710,Khaki,8x10 in
33,Fan Phone,Term collection whatever the.,Camping & Hiking,335,921,SkyBlue,50x70 cm
34,Pro Stove Eco Smart,Consumer leave media wrong nor word.,Cycling,663,695,Crimson,XXL
35,Charger,Phone mention really reach.,Fitness Equipment,596,52,Green,L
36,Fan Phone,Smile market would trouble center.,Laptops & Computers,385,219,Orchid,10x10 cm
37,Fan Powerbank,Your tree never bit each this rock.,Kids' Clothing,825,93,DarkSlateGray,8x10 in
38,Premium Router Lamp,Daughter interesting ball way.,Home Decor,245,243,SlateBlue,100x200 mm
39,Smart Keyboard Toaster Monitor,State almost summer board church tree former.,Cameras & Accessories,573,671,DarkGoldenRod,Large
40,Pro Iron Drone Ultra,Like find store police single.,Shoes & Footwear,536,188,GhostWhite,Medium
41,Fan,Thing least interest around building table.,Books & Stationery,783,56,Magenta,XS
42,Fast Cooler Prime Advanced,Particularly gas security land.,Team Sports,181,117,LightSlateGray,M
43,Advanced Webcam Printer,Argue maybe TV media change it.,"Accessories (Bags, Hats, Belts)",914,136,Cyan,12x18 in
44,Premium Scooter,Where direction produce company employee edge thus news.,Team Sports,486,773,Aqua,12x18 in
45,Eco Vacuum Iron Phone Clean One Max,Ten heart tree see movie.,Office Supplies,20,397,DarkOliveGreen,15x20 cm
46,Clean Drone Heater Scanner Digital Eco Rechargeable,Million process south including.,Kids' Clothing,162,322,ForestGreen,Extra Large
47,Portable Drone Heater Scanner Lite Premium,Trial visit me model simple beat idea each.,Office Supplies,363,850,PeachPuff,L
48,Ultra Brush,Ahead doctor reflect seven buy reason.,Makeup,818,491,DarkViolet,5x7 in
49,Charger Lock Oven,Old head military most enjoy sense.,Health & Wellness,84,947,MintCream,50x70 cm
50,Automatic Clock Lock Digital Touch,Gas look modern.,Automotive,549,303,PaleGreen,XS
51,Cooker Cooler,Man could who manage.,Shoes & Footwear,643,744,DarkGoldenRod,L
52,Iron Heater,Another method past do wind sometimes.,Headphones & Earbuds,459,769,Gainsboro,Extra Large
53,Advanced Powerbank Touch Max,Current care cover cause indicate experience purpose.,Office Supplies,273,582,DarkSlateBlue,100x200 mm
54,Digital Projector Oven Thermostat Pro,House close service wall expert economic.,Laptops & Computers,306,653,Red,L
55,Eco Grill Automatic,Avoid television area election their reduce now size.,Grooming Tools,976,306,Cornsilk,Small
56,Smart Tablet Speaker Scooter,Soldier local lay.,Smartphones,980,984,PaleGreen,M
57,Eco Toaster Oven Eco Compact Wireless,Assume something defense race.,Clothing & Apparel,565,394,Cyan,L
58,Premium Cooler Digital Max,Manager finally now.,Books & Stationery,887,501,Lime,Medium
59,Clean Camera Drone Fan One Max,Fact bit also look particular Congress know.,Men's Clothing,466,539,Salmon,12x18 in
60,Fan Drone Monitor,College which care Democrat.,Health & Wellness,542,7,PaleTurquoise,L
61,Smart Heater Toaster Stove 360 Premium,At forget side major finally past.,Cameras & Accessories,919,536,White,8x10 in
62,Advanced Toaster Scanner,Again always include past later drive outside yet.,Bedding & Bath,310,874,Magenta,100x200 mm
63,Automatic Camera Monitor Charger,Large really present up.,Grooming Tools,873,679,Purple,15x20 cm
64,Wireless Grill Grill Silent,Shake movie room site.,Kitchen Appliances,181,608,LightPink,XS
65,Fast Clock Brush Prime,Himself fine degree factor skin final participant.,Fishing & Hunting,80,221,MediumBlue,S
66,Digital Keyboard,Subject protect difficult discover fire call picture.,Smartphones,989,756,Tomato,100x200 mm
67,Fast Tablet,Area leave there affect.,Furniture,567,46,SaddleBrown,50x70 cm
68,Fan Powerbank,Participant learn wish it magazine.,"Accessories (Bags, Hats, Belts)",660,677,LavenderBlush,12x18 in
69,Heater Radio,So without hotel great.,Men's Clothing,347,113,OldLace,100x200 mm
70,Bicycle Scooter,Involve position military involve.,Skincare,866,836,Red,15x20 cm
71,Ultra Freezer Smart X Prime,Conference table song.,Laptops & Computers,990,641,OliveDrab,Small
72,Advanced Drone Heater Scanner Wireless,Stop rise speak far.,"Accessories (Bags, Hats, Belts)",908,533,Aqua,Small
73,Light Heater Clock,Already yet war cold.,Home Decor,489,779,Chocolate,50x70 cm
74,Smart Fan Touch Rechargeable Fast,Mouth give follow ground act win treat.,Health & Wellness,971,326,OldLace,XS
75,Heater,Wrong we discover seat center federal support fight.,Cleaning Supplies,757,59,Pink,S
76,Silent Iron Monitor Eco,Bit quite light draw occur product begin.,Automotive,892,895,DarkCyan,8x10 in
77,Eco Oven Mouse Cooler Touch Wireless Advanced,Development another ball individual herself.,Laptops & Computers,348,554,DarkGoldenRod,Small
78,Premium Charger Bicycle Fan Eco,Draw company own third strong.,Sports & Outdoors,769,998,Cornsilk,15x20 cm
79,Microphone Heater,Hold song fish senior expect.,Toys & Games,200,177,Aquamarine,XS
80,Mixer,Southern mention door among its theory.,Fragrances,490,915,DarkOrange,8x10 in
81,Advanced Thermostat Eco,Could south within allow level sense prove.,Smartwatches,329,110,Bisque,S
82,Eco Printer Advanced,Know gun sing course.,Health & Wellness,576,711,Thistle,10x10 cm
83,Scanner Drone,Watch that term somebody rest happy.,Smartwatches,823,944,Moccasin,Small
84,Eco Cooler Treadmill Rechargeable,Safe each whom rich that live image.,Laptops & Computers,119,907,DarkSlateBlue,50x70 cm
85,Fan,Right sea prevent country painting.,Health & Wellness,406,425,MidnightBlue,Small
86,Mini Treadmill Dock Compact,News into find floor government candidate bed.,Smartwatches,371,895,Pink,30x40 cm
87,Portable Blender Wireless,Believe indicate seven us.,Cycling,798,477,Silver,100x200 mm
88,Portable Iron Monitor Premium Pro Eco,End from send.,Cycling,20,182,Thistle,XS
89,Scooter Scale Cooler,Trip that like better.,Fragrances,765,4,Magenta,15x20 cm
90,Freezer,Investment resource speak improve building people.,Home Decor,765,566,BlueViolet,XS
91,Advanced Blender,Republican billion activity very contain poor.,Office Supplies,517,210,Gold,10x10 cm
92,Digital Radio Radio Pro,Pretty quickly around maintain eight.,Fragrances,536,504,Green,XS
93,Ultra Kettle,Market camera federal like.,Skincare,650,885,Brown,XXL
94,Silent Lock Thermostat Air Touch,Participant course paper scene foreign.,Fishing & Hunting,974,522,Turquoise,XS
95,Iron,Current protect federal huge design.,Makeup,59,764,DarkSlateGray,15x20 cm
96,Digital Scanner Rechargeable Ultra Prime,Suffer ability specific job audience court.,Skincare,867,948,GhostWhite,Large
97,Advanced Blender Toaster Camera,Low month none Congress certain build history.,Cleaning Supplies,371,627,LightSlateGray,15x20 cm
98,Automatic Watch Thermostat Clean,Nation then begin clearly part structure executive.,Bedding & Bath,320,98,LightGray,XS
99,Microphone Treadmill Oven,Minute myself smile doctor present.,Beauty & Personal Care,757,887,Bisque,8x10 in
100,Premium Powerbank Iron Brush Edge Prime,I open cold year.,Smartphones,669,903,LavenderBlush,8x10 in
101,Rechargeable Headphones X Lite 360,Note cost opportunity information.,Haircare,829,751,Khaki,15x20 cm
102,Heater Mixer Shaver,Foot major quickly rock.,Automotive,459,465,PapayaWhip,5x7 in
103,Compact Vacuum,Start whatever industry science herself natural painting.,Bedding & Bath,298,831,FireBrick,S
104,Compact Mixer Freezer Trimmer,International all four.,Kitchen Appliances,766,170,WhiteSmoke,10x10 cm
105,Pro Projector Mini Air,Interest popular down child around rock issue cause.,Haircare,594,180,PaleVioletRed,50x70 cm
106,Silent Fan Fast One,Week situation of air nothing cost spring.,Toys & Games,969,947,Azure,L
107,Wireless Projector Mini,Or age seat charge central happen.,Camping & Hiking,423,521,SeaShell,12x18 in
108,Rechargeable Treadmill,Might bill another look single hospital.,Team Sports,494,463,MediumVioletRed,10x10 cm
109,Digital Toaster Scanner Touch,Individual buy read.,Automotive,729,42,GhostWhite,Large
110,Iron Thermostat,Great across beat answer very investment.,Grooming Tools,54,750,DarkGreen,Extra Large
111,Eco Powerbank Digital Ultra,Wait add rest particular seven alone.,Kitchen Appliances,317,888,AliceBlue,Small
112,Fast Fridge Mouse Monitor Silent,Discuss bill water forward.,Fitness Equipment,566,249,Violet,15x20 cm
113,Smart Mixer Lamp Premium,Debate herself car dream agreement.,Sports & Outdoors,721,613,HotPink,50x70 cm
114,Premium Powerbank Router Compact Pro Sense,Lead fly site control test speak need.,Shoes & Footwear,469,59,DarkOrange,100x200 mm
115,Digital Fridge Fan Lamp Compact,Receive financial loss process only business.,Beauty & Personal Care,872,848,Cornsilk,S
116,Mouse,Nearly work voice actually answer receive practice lay.,Automotive,674,975,NavajoWhite,15x20 cm
117,Smart Lamp Prime Ultra,Environment recognize animal network.,"Accessories (Bags, Hats, Belts)",931,240,SkyBlue,5x7 in
118,Portable Watch Go Lite,Forward until value option finally.,Books & Stationery,207,82,SteelBlue,15x20 cm
119,Wireless Webcam Trimmer Projector Automatic Advanced Portable,Detail fear of whom.,Home Decor,393,885,Pink,5x7 in
120,Ultra Fan Advanced,Experience suggest many cut here really project.,Home Decor,19,632,Tan,12x18 in
121,Pro Watch Fridge Ultra Digital,Process believe open growth fly.,Sports & Outdoors,864,140,Gold,XL
122,Eco Headphones Premium X,Add consumer without nor.,Fitness Equipment,349,184,SeaShell,15x20 cm
123,Tablet Blender,Represent should result require book sea.,Cycling,87,764,Violet,10x10 cm
124,Pro Headphones Monitor,Technology understand step military sound item themselves.,Clothing & Apparel,522,60,LawnGreen,XS
125,Digital Lamp Blender Drone,We around eat better which couple.,Women's Clothing,368,232,Maroon,5x7 in
126,Smart Scanner Tablet Radio,Court week course recent employee view early.,Smartphones,406,599,DarkSlateBlue,Large
127,Stove Blender Oven,Matter expect certainly any item western.,Clothing & Apparel,274,399,Red,8x10 in
128,Pro Clock Brush Pro Wireless,American drop drug center mind.,Books & Stationery,823,460,Aqua,XL
129,Projector Freezer,Fire miss agency key school.,"Accessories (Bags, Hats, Belts)",850,72,LightGoldenRodYellow,30x40 cm
130,Fast Scanner Mouse Wireless Air Lite,Dream rich green partner.,Women's Clothing,384,403,SeaShell,30x40 cm
131,Silent Charger Tablet Brush,End carry produce page sea young.,Fishing & Hunting,459,117,DimGray,10x10 cm
132,Dock,Policy lose station me above record all.,Office Supplies,23,99,Thistle,50x70 cm
133,Dock Dock Trimmer,Reveal recent though stand president.,Cleaning Supplies,869,504,Lavender,Extra Large
134,Premium Radio Rechargeable Max Mini,Despite turn grow accept measure responsibility.,Books & Stationery,66,306,OliveDrab,XXL
135,Smart Tablet Tablet Kettle Mini,Television successful every wide.,Women's Clothing,859,190,Aqua,Medium
136,Ultra Mixer Freezer Trimmer Digital Wireless Plus,Protect imagine senior almost.,Headphones & Earbuds,519,188,PowderBlue,50x70 cm
137,Smart Thermostat Camera Watch Smart One,Before someone pull get nice town.,Fishing & Hunting,146,775,Thistle,XS
138,Fast Drone Printer Tablet,Movement drug end.,Laptops & Computers,395,738,Cyan,Small
139,Premium Blender Cooker Prime,Left economy anything or deal.,Headphones & Earbuds,528,179,Crimson,L
140,Advanced Freezer Clean,Score state right moment pressure address.,Health & Wellness,959,285,PowderBlue,10x10 cm
141,Automatic Speaker Router Lamp Pro,Different let program yet.,Skincare,16,676,Violet,10x10 cm
142,Advanced Mixer Drone Fan Premium,Pull until affect he.,Home Decor,608,945,Silver,XL
143,Wireless Vacuum Cooler,Goal forward wrong set Mrs only information.,Team Sports,854,787,MediumSeaGreen,Large
144,Smart Router Lamp,Receive total close.,Cleaning Supplies,385,761,SaddleBrown,10x10 cm
145,Compact Bicycle Speakerphone Printer Prime 360,Learn decision late fact science third.,Beauty & Personal Care,361,852,Chartreuse,Large
146,Digital Trimmer Clock X Digital Pro,Discussion move investment project its ask pressure.,Home Decor,225,295,Brown,Medium
147,Mini Watch Headphones Kettle Max Portable X,Parent country write civil organization.,Camping & Hiking,881,454,DarkBlue,M
148,Wireless Speaker Keyboard,Now speak before ability.,"Accessories (Bags, Hats, Belts)",848,268,Navy,XS
149,Eco Thermostat Camera Watch,Model high under forget seek necessary.,Cleaning Supplies,837,999,Linen,50x70 cm
150,Compact Camera One Mini Smart,Standard travel focus test make treat rest attack.,Sports & Outdoors,709,664,HotPink,8x10 in
151,Silent Webcam Scooter,News get board admit on.,"Accessories (Bags, Hats, Belts)",946,84,MidnightBlue,XXL
152,Drone,List fire candidate doctor.,Home & Kitchen,355,833,DarkBlue,XL
153,Automatic Clock Drone Charger,Present whose teacher over born hospital.,Toys & Games,357,870,PowderBlue,M
154,Clean Watch Headphones Kettle Air Fast,Arm free after eight play.,Fragrances,45,175,OrangeRed,10x10 cm
155,Mini Oven Drone,Avoid member machine Republican cause ok.,Sports & Outdoors,432,330,MediumTurquoise,M
156,Portable Grill Tablet Fridge X Air,Use nothing building another PM.,Bedding & Bath,249,845,LightCyan,Small
157,Clean Thermostat Printer Premium Prime,Space statement candidate hand staff article hundred.,Headphones & Earbuds,140,704,MediumTurquoise,100x200 mm
158,Ultra Lamp Clean Edge,Official process strategy technology.,Smartwatches,807,721,Lavender,Medium
159,Fast Mouse Sense Smart,Account couple discussion call.,Skincare,622,890,RosyBrown,30x40 cm
160,Oven Scale,Just age address total six become citizen claim.,Men's Clothing,226,12,SandyBrown,XS
161,Rechargeable Cooler Mini Ultra,Should raise serve more sea step.,Makeup,82,558,Gray,8x10 in
162,Phone,Adult real discover cell far.,Haircare,489,956,Gainsboro,Small
163,Iron Microphone,Drive style present push space admit power.,Women's Clothing,463,64,SaddleBrown,Large
164,Smart Drone Thermostat Headphones Touch Go Eco,Relate future see last industry.,Smartphones,505,351,Cornsilk,XL
165,Mini Thermostat Webcam Bicycle,Evidence beat stand over partner same social.,Headphones & Earbuds,891,978,DodgerBlue,M
166,Speaker Iron Grill,About produce hope Mrs international foreign.,Automotive,388,325,LavenderBlush,5x7 in
167,Automatic Headphones Fast Pro Rechargeable,Baby where trip agency religious cut.,Laptops & Computers,884,955,BlanchedAlmond,S
168,Portable Toaster Scooter Air,Foot bring even war next.,Cleaning Supplies,26,857,DarkSlateGray,L
169,Mini Webcam Trimmer Projector Digital Fast,Form cup billion race film mean large.,Clothing & Apparel,847,241,MediumSpringGreen,12x18 in
170,Toaster Light Monitor,Food sign oil.,Camping & Hiking,99,191,Gainsboro,8x10 in
171,Compact Microphone Treadmill Oven Plus,Strong go three decade ahead usually.,Cleaning Supplies,435,962,MidnightBlue,30x40 cm
172,Projector Freezer,Citizen east run perform summer kind enjoy line.,Laptops & Computers,786,107,Gray,15x20 cm
173,Ultra Scooter,Word economic kid degree.,Smartphones,295,512,DarkBlue,S
174,Premium Watch Grill Compact Ultra 360,Situation figure positive remain Democrat space hold.,Grooming Tools,583,38,GreenYellow,100x200 mm
175,Ultra Scooter Wireless Clean Touch,Treatment create grow heart three.,Bedding & Bath,884,250,WhiteSmoke,8x10 in
176,Portable Heater Toaster Stove Fast,Air hit rather serve network wait environment.,Home Decor,567,51,Fuchsia,L
177,Smart Powerbank Iron Brush Wireless,Minute collection role fly risk determine itself morning.,Smartphones,488,498,Crimson,50x70 cm
178,Ultra Camera Silent,Course water return scientist enough race.,Grooming Tools,256,65,Turquoise,XXL
179,Pro Light Drone Fast Fast,Class employee stay organization why coach use else.,Automotive,366,290,DarkViolet,Medium
180,Compact Drone Fast Lite Mini,Exist open game building term let nearly.,Office Supplies,731,557,MediumTurquoise,50x70 cm
181,Compact Radio,Put boy help strong rise consider wife bring.,Fishing & Hunting,763,534,OrangeRed,XL
182,Smart Router Lamp 360 360 Silent,Sign wind miss drop visit.,Grooming Tools,646,616,LightSalmon,Medium
183,Fridge Fan Lamp,Song receive system sure.,Camping & Hiking,416,98,DarkCyan,30x40 cm
184,Fan Clock Camera,Property share you parent just security.,Fragrances,583,144,HotPink,XS
185,Webcam Scooter,Media general individual sea around morning.,Headphones & Earbuds,229,802,Olive,15x20 cm
186,Light Drone,Public prepare detail series.,Automotive,113,169,ForestGreen,Medium
187,Automatic Charger Bicycle Cooker Mini Pro,Course company lot contain before water person.,Automotive,720,557,DeepPink,L
188,Premium Blender Air,Marriage personal say job opportunity.,Sports & Outdoors,351,395,Tan,M
189,Smart Scale Prime Air,Whatever different plan life life.,Office Supplies,305,121,BlueViolet,L
190,Monitor Light,North subject guess space.,Kitchen Appliances,302,292,SandyBrown,10x10 cm
191,Microphone Cooler,Pattern bad appear interview lay threat most.,Cycling,565,46,SandyBrown,Large
192,Grill Tablet Fridge,Mouth day road foot from onto rise.,Grooming Tools,326,486,OrangeRed,M
193,Clean Bicycle Wireless Digital Lite,Late western two fire above address hold commercial.,Fishing & Hunting,504,826,DarkSlateBlue,100x200 mm
194,Automatic Charger Bicycle Fan,Company computer us economic tonight operation agent.,Home & Kitchen,677,962,BlanchedAlmond,XL
195,Pro Powerbank Cooker Iron Ultra,Lawyer economy cut movie movement artist.,Fitness Equipment,991,756,OliveDrab,Large
196,Digital Scooter Rechargeable Clean Portable,Hold position evidence first season prepare.,Automotive,414,392,MintCream,XS
197,Compact Thermostat Microphone Scooter Silent,Form also field hold investment material.,Books & Stationery,355,748,PaleGreen,15x20 cm
198,Fast Mouse Digital Portable Plus,Organization under size grow old.,Home Decor,818,64,Salmon,XXL
199,Automatic Watch Grill,Manage thank somebody face wind space material.,"Accessories (Bags, Hats, Belts)",673,633,Teal,Small
200,Wireless Printer Fan Air Lite Go,Behind national manage new.,Makeup,748,143,Tan,5x7 in
201,Pro Brush,Education red give chance whether.,Cameras & Accessories,525,329,Aqua,Large
202,Smart Router,There walk new thing add.,Bedding & Bath,742,148,LightSteelBlue,XL
203,Eco Projector,Matter wall international research.,Headphones & Earbuds,380,215,PaleVioletRed,S
204,Digital Grill Microphone Projector,Draw lot green throw drug at environmental.,Grooming Tools,869,533,Linen,Large
205,Silent Mixer Treadmill Touch Smart Advanced,Among inside success into program face around fast.,Skincare,318,786,WhiteSmoke,30x40 cm
206,Clean Radio Rechargeable,Guy deep agent.,Haircare,297,920,Moccasin,XL
207,Compact Clock Lock,Old career challenge current see brother save.,Clothing & Apparel,575,20,DarkOrchid,M
208,Webcam Projector Oven,Evening beautiful reflect lead.,Home & Kitchen,998,632,NavajoWhite,Extra Large
209,Advanced Mouse Lamp 360,Light quickly husband environment.,Furniture,45,892,DarkSlateGray,XS
210,Automatic Heater Stove Scanner,To sometimes quite adult performance.,Cameras & Accessories,622,921,DodgerBlue,XS
211,Scooter,Author person create list.,Smartwatches,232,205,DarkViolet,15x20 cm
212,Eco Camera,Truth while food western occur.,Furniture,805,426,Gainsboro,Extra Large
213,Fast Printer Lock Thermostat Automatic Go Digital,Their executive visit really.,Haircare,938,993,Gray,XL
214,Automatic Lock Freezer,About effort approach model alone.,Smartphones,688,17,CornflowerBlue,50x70 cm
215,Ultra Radio Eco,Life at stock statement reflect view.,Kitchen Appliances,698,179,DarkMagenta,Small
216,Clean Lock Thermostat,Trial debate ready.,Office Supplies,77,243,IndianRed,L
217,Fast Freezer Max,Property its thousand control population recognize operation range.,Health & Wellness,136,959,DarkOrchid,Medium
218,Mixer Treadmill,Believe rather choose.,Home & Kitchen,680,358,Gainsboro,100x200 mm
219,Thermostat Stove Lamp,According have sea drive woman.,Books & Stationery,934,704,Tomato,XL
220,Wireless Dock Eco X Automatic,Drug side significant animal.,Camping & Hiking,342,531,SkyBlue,XXL
221,Dock Dock Trimmer,Look movement cultural thing his issue source.,Fragrances,449,227,Gray,15x20 cm
222,Silent Grill Grill Scale,Guess early fly room onto.,Fishing & Hunting,612,662,Wheat,Extra Large
223,Shaver Thermostat,Hundred team him music decade meet.,Haircare,422,651,DarkMagenta,Small
224,Digital Charger Cooker Thermostat Premium Portable,Model any policy protect face among international.,Shoes & Footwear,939,269,DodgerBlue,M
225,Premium Camera Keyboard Sense Lite Plus,Wish particularly should blood miss send system.,Shoes & Footwear,224,891,DarkTurquoise,XXL
226,Smart Lock Edge,Discussion total off.,Kitchen Appliances,44,134,ForestGreen,15x20 cm
227,Smart Heater Keyboard 360 360,Gas fear human bed.,Skincare,931,828,DarkOrchid,XXL
228,Wireless Grill Brush Watch Pro,With peace across option night.,Books & Stationery,24,120,BlanchedAlmond,S
229,Premium Kettle Clean Smart Rechargeable,Where raise authority else wonder.,Smartwatches,467,430,DeepSkyBlue,XS
230,Wireless Headphones Fast Lite Premium,Thus doctor page month last art practice.,Toys & Games,635,360,DarkSlateBlue,50x70 cm
231,Smart Light Clean,Fish industry important official newspaper.,Shoes & Footwear,447,738,ForestGreen,8x10 in
232,Smart Brush Blender Vacuum,Instead public moment suddenly attention.,Bedding & Bath,990,968,Tomato,50x70 cm
233,Wireless Heater Monitor Max Clean,Guy consider career better.,Toys & Games,447,570,Violet,30x40 cm
234,Ultra Speakerphone Oven Air,Hard song method positive man game.,"Accessories (Bags, Hats, Belts)",256,89,OldLace,L
235,Smart Fan Monitor Toaster Advanced One 360,Different paper article side agency century.,Camping & Hiking,609,950,DarkSalmon,50x70 cm
236,Wireless Camera Advanced,Reality never sell once contain occur.,Fragrances,144,8,Bisque,XL
237,Rechargeable Light Webcam Cooker Go,Certainly difference fill two but language give.,Clothing & Apparel,284,339,LimeGreen,XXL
238,Ultra Oven Go Fast,Show control trial central south action region.,Health & Wellness,707,158,Gold,15x20 cm
239,Automatic Drone Silent Prime Premium,Skill any for woman.,Clothing & Apparel,176,861,CornflowerBlue,Extra Large
240,Eco Webcam Toaster Fast Prime Mini,Suffer free whom particular line.,Cleaning Supplies,636,663,BlanchedAlmond,Small
241,Speaker Router Lamp,Over adult management speak.,Cameras & Accessories,337,243,LightCyan,8x10 in
