Index,Name,Description,Category,Price,Stock,Color,Size
478,Eco Scale Headphones,Back make drug positive leg decide study.,Men's Clothing,52,2,LightCyan,M
479,Digital Keyboard Kettle Wireless Fast,Size begin participant run pretty stuff.,Clothing & Apparel,683,286,LawnGreen,S
480,Printer,Half such affect number in.,Camping & Hiking,959,994,Magenta,M
481,Wireless Bicycle Scooter,Leave lot million.,Furniture,288,809,PaleTurquoise,8x10 in
482,Compact Headphones Charger Digital Touch One,Himself everyone good west.,Shoes & Footwear,16,764,LimeGreen,XL
483,Kettle,Head management any tough live.,Office Supplies,176,27,MediumBlue,100x200 mm
484,Ultra Iron Toaster Projector Compact Plus,Number glass direction music voice.,Grooming Tools,898,891,MediumVioletRed,Medium
485,Mini Clock Brush Clean,In create air low have.,Automotive,863,840,Chartreuse,10x10 cm
486,Wireless Cooker Advanced,Could several sign around.,Fishing & Hunting,380,282,DarkGoldenRod,S
487,Brush Blender Vacuum,Green more protect though remember power.,Smartwatches,112,299,DarkSeaGreen,XXL
488,Dock,Food how bad story identify.,Women's Clothing,346,665,SkyBlue,M
489,Rechargeable Mouse Treadmill Phone Smart Clean Premium,Southern investment true him turn live music.,Fishing & Hunting,442,802,OliveDrab,L
490,Ultra Oven Scale,Campaign customer building.,Home & Kitchen,146,721,ForestGreen,XXL
491,Rechargeable Scooter Bicycle Oven One One Fast,Left his quite.,Laptops & Computers,585,968,YellowGreen,Medium
492,Printer Charger Brush,Pressure often area clearly.,Kids' Clothing,917,618,Ivory,50x70 cm
493,Ultra Heater Keyboard,Figure hand right anyone want someone raise.,Health & Wellness,901,469,FloralWhite,12x18 in
494,Digital Grill Grill Sense Edge Smart,Spring contain to increase every audience specific increase.,Smartwatches,384,736,LightSkyBlue,L
495,Pro Radio One Touch,Spend identify rather style east as.,Books & Stationery,757,563,AliceBlue,L
496,Speaker Iron Grill,Admit hope building medical easy he.,Haircare,961,658,DarkSlateBlue,XL
497,Compact Router Smart,About increase matter collection structure interesting operation star.,Grooming Tools,624,223,Cornsilk,L
498,Cooler Watch Fan,Project section change ground teach.,Beauty & Personal Care,955,50,Navy,L
499,Clean Blender Eco Plus,Card evidence career author learn soldier through white.,Home & Kitchen,420,561,Orange,5x7 in
500,Automatic Fan,Wall ability customer join family.,Fitness Equipment,478,879,PaleVioletRed,XS
501,Rechargeable Cooker,Right onto human page.,Cleaning Supplies,469,965,PaleVioletRed,5x7 in
502,Mini Grill Charger Headphones,Check trial reach.,Sports & Outdoors,305,491,Salmon,L
503,Camera Treadmill Heater,Situation grow threat run million prepare economic.,Toys & Games,907,463,DarkOrange,Large
504,Portable Cooler Printer Speaker Ultra,Technology bed support section staff.,Kitchen Appliances,265,327,Black,8x10 in
505,Heater Thermostat,Cup stuff investment for southern ok.,Cycling,261,148,DarkTurquoise,100x200 mm
506,Advanced Clock Air Edge Premium,What police parent fund agreement without stand.,Grooming Tools,455,364,SandyBrown,S
507,Clean Brush Lock Eco,Religious stuff TV.,Camping & Hiking,301,718,MintCream,M
508,Printer Fan,Hotel person improve civil others box.,Laptops & Computers,266,917,DarkGray,S
509,Premium Mixer Bicycle Fridge Mini 360 Automatic,Shoulder any fund throw ground.,Home & Kitchen,534,155,Peru,100x200 mm
510,Pro Iron Toaster Projector,Other paper case case series soon take.,Kids' Clothing,632,662,Moccasin,50x70 cm
511,Smart Charger Treadmill Go Smart One,Network here itself among collection teacher.,Smartwatches,626,431,SlateGray,Extra Large
512,Premium Lock Camera,Model mind message top.,Health & Wellness,385,155,PaleTurquoise,8x10 in
513,Smart Cooler Touch Pro Edge,Safe herself box smile arm body easy.,"Accessories (Bags, Hats, Belts)",943,323,Yellow,15x20 cm
514,Smart Projector Freezer Smart,Sport once either here so risk go.,"Accessories (Bags, Hats, Belts)",696,748,LightSlateGray,5x7 in
515,Advanced Keyboard Portable,When community if senior affect law when.,Headphones & Earbuds,869,595,DarkTurquoise,12x18 in
516,Advanced Thermostat Stove Lamp,Since wall take range.,Books & Stationery,301,424,MediumVioletRed,M
517,Projector,Bank push true set place.,Smartphones,216,374,DarkSlateGray,XL
518,Projector,Difficult young occur performance expert peace.,Automotive,392,747,RoyalBlue,L
519,Wireless Heater Toaster Stove,Century enough character write.,Office Supplies,187,260,SlateBlue,XXL
520,Blender Blender,Field senior letter writer.,Laptops & Computers,20,288,MediumAquaMarine,Medium
521,Webcam Webcam Stove,Pm common wall control often choice step that.,Headphones & Earbuds,139,239,SlateBlue,S
522,Light Drone,Style arm cultural television low majority.,Skincare,928,429,White,8x10 in
523,Wireless Stove Iron Smart Advanced,Baby sometimes edge voice election least.,Men's Clothing,16,227,Gainsboro,M
524,Fast Scooter Eco Premium,Economic price bring old politics they.,Home & Kitchen,409,960,Fuchsia,S
525,Advanced Headphones Monitor Go Automatic,Success when life animal.,Beauty & Personal Care,219,381,Linen,8x10 in
526,Clean Brush Blender,Increase operation number allow hotel.,Bedding & Bath,692,482,MintCream,S
527,Smart Blender Treadmill Tablet,People appear enter art fast series.,Cameras & Accessories,579,647,Maroon,12x18 in
528,Compact Charger Cooker Thermostat Go Mini Smart,Perform from wall so particular where.,Makeup,968,504,White,XXL
529,Compact Scanner 360 Plus Ultra,Speak miss form view discussion interview where want.,Kids' Clothing,288,824,Chocolate,8x10 in
530,Ultra Charger Cooker Thermostat One Prime,Girl environment apply traditional charge.,Fragrances,415,146,SteelBlue,15x20 cm
531,Rechargeable Radio Radio Portable Clean Premium,Teacher discover suddenly point never land.,Kitchen Appliances,112,924,Blue,50x70 cm
532,Portable Camera Bicycle Speakerphone,Song something there wall mother wind.,Sports & Outdoors,852,114,PaleTurquoise,M
533,Radio,Late source reduce.,Makeup,561,290,Magenta,Large
534,Clean Mixer Drone Toaster,Behavior class yard home page operation.,Shoes & Footwear,406,341,SaddleBrown,L
535,Premium Tablet Microphone Trimmer Fast,Too option music camera vote.,Smartwatches,948,936,DarkOliveGreen,M
536,Brush,Defense receive last may.,Cleaning Supplies,360,701,DarkSalmon,XS
537,Smart Charger Monitor Brush,Throw keep very nearly.,"Accessories (Bags, Hats, Belts)",82,267,LightPink,12x18 in
538,Wireless Watch Go Sense Ultra,Poor western with hold step.,Cycling,933,288,Snow,12x18 in
539,Drone Printer,Recognize general admit world.,Health & Wellness,445,611,DeepPink,10x10 cm
540,Premium Printer Lock Thermostat 360,Mind provide contain try various trial.,Smartwatches,481,426,BlueViolet,8x10 in
541,Fast Heater Keyboard Eco,Bit first grow offer accept information.,Office Supplies,11,646,Yellow,XS
542,Smart Fan Fast Premium,Though should dream both front century.,Health & Wellness,928,372,Purple,S
543,Premium Shaver Go,Tonight these lawyer contain.,Cycling,929,919,MediumVioletRed,M
544,Portable Dock Smart Advanced,Appear though us value bar thousand.,Headphones & Earbuds,594,557,PaleTurquoise,Large
545,Wireless Brush 360 Ultra,Response feel hear old stuff respond car.,Kids' Clothing,951,750,BlanchedAlmond,L
546,Rechargeable Oven Mouse Cooler Eco,Class difficult during production fire glass what.,Fragrances,397,624,LightGray,XL
547,Advanced Brush Fridge Drone Advanced Prime,Capital politics stop serve.,Team Sports,699,42,DarkOliveGreen,8x10 in
548,Clean Mouse Speaker Cooler Touch One Silent,Both girl resource rise away.,Furniture,499,677,Aqua,XXL
549,Advanced Microphone Clock Smart,Discussion American ability everything few nature car.,Grooming Tools,554,46,Aqua,Extra Large
550,Speaker Tablet Headphones,Turn simple choose central.,Team Sports,319,410,SeaShell,8x10 in
551,Eco Webcam Powerbank Smart Prime Automatic,Middle serve forget.,Men's Clothing,310,6,Pink,12x18 in
552,Mini Radio Mixer X Edge Eco,Wonder raise learn design.,Kitchen Appliances,805,858,Ivory,L
553,Eco Webcam Smart,Want someone rate eat.,Toys & Games,99,663,IndianRed,8x10 in
554,Ultra Scanner Drone Portable,Statement site east change base wind nice.,Laptops & Computers,74,359,DarkViolet,8x10 in
555,Lamp,Reveal miss evening eye brother.,Fishing & Hunting,615,239,MediumBlue,L
556,Smart Iron Microphone Smart One Premium,State present control wind.,Smartphones,544,500,OldLace,XL
557,Wireless Treadmill Touch,Customer somebody on where.,Team Sports,395,614,FloralWhite,S
558,Clean Stove Iron 360 Edge Wireless,Fact fear door land fly bit role wait.,Toys & Games,930,771,DarkOliveGreen,Extra Large
559,Drone Heater Scanner,Start tax always treat challenge join morning.,Fitness Equipment,738,35,DarkSeaGreen,10x10 cm
560,Portable Fan Scooter Trimmer,Risk hundred six fall box.,Haircare,681,49,DarkOrange,30x40 cm
561,Compact Lock Touch,Answer school operation behavior late pull.,Home & Kitchen,197,666,Ivory,XL
562,Premium Cooler Vacuum,Notice difference kid use.,Smartwatches,659,776,DimGray,Large
563,Compact Thermostat Trimmer Eco Max,Mission Congress very community kitchen.,Headphones & Earbuds,583,890,SaddleBrown,5x7 in
564,Wireless Fan Scooter Trimmer 360 Clean Fast,Choose where clear respond the coach no main.,Shoes & Footwear,694,546,LightYellow,XL
565,Wireless Powerbank Cooker Iron,Smile plant full ability camera really each.,Kids' Clothing,527,556,DeepSkyBlue,50x70 cm
566,Fast Iron Thermostat Compact,Carry region list positive rest across.,Furniture,836,620,Green,10x10 cm
567,Premium Scale Trimmer Grill Fast Silent,May recent hope fast cost.,Shoes & Footwear,598,50,ForestGreen,10x10 cm
568,Advanced Watch Camera One Go,Evening sure shake new democratic order detail consumer.,Automotive,266,994,LightCoral,L
569,Wireless Keyboard Speakerphone Fan Ultra,Team lay nor her modern serve history new.,Fishing & Hunting,497,605,Brown,Small
570,Silent Vacuum Webcam Rechargeable,Alone piece our then what style.,Cameras & Accessories,897,448,Gray,XS
571,Ultra Treadmill Rechargeable,Great often administration worry every.,Fragrances,102,179,LightBlue,XXL
572,Rechargeable Mixer Drone Toaster,Traditional hot how.,Toys & Games,806,895,DarkOliveGreen,XXL
573,Eco Brush Scale Grill Ultra,Under clearly main under service.,Beauty & Personal Care,383,437,AliceBlue,XL
574,Smart Charger Bicycle Cooker Advanced Air,Draw popular source same.,Makeup,128,484,LightGoldenRodYellow,Large
575,Thermostat Printer,Nor night without science.,Skincare,552,465,LightSeaGreen,XL
576,Clean Heater Keyboard,Information wife manage bill amount black produce fund.,Camping & Hiking,216,441,NavajoWhite,30x40 cm
577,Premium Thermostat Advanced Go,Board possible effect institution.,Clothing & Apparel,546,587,DarkGoldenRod,Large
578,Rechargeable Vacuum Printer,Serious just gun old crime discuss professional.,Fragrances,72,515,DarkOrchid,8x10 in
579,Digital Clock Brush,Significant worker theory letter himself somebody.,Men's Clothing,194,234,Bisque,XS
580,Portable Watch Thermostat,Style produce especially.,Women's Clothing,477,442,CadetBlue,100x200 mm
581,Advanced Grill Lite,Paper program start.,Grooming Tools,426,986,PeachPuff,L
582,Rechargeable Watch Digital Max,Nature population hit southern budget.,Fitness Equipment,628,147,LightSeaGreen,Medium
583,Silent Microphone Clock Touch Smart Wireless,Just enough usually best citizen lawyer.,Team Sports,184,926,DarkGray,10x10 cm
584,Wireless Powerbank Pro Wireless,Start word down high while indeed.,Home Decor,726,335,LightSkyBlue,S
585,Digital Clock Automatic,Help them whatever list.,Office Supplies,95,200,Gold,30x40 cm
586,Clean Treadmill Silent Smart,Boy speech management he accept.,Cycling,908,718,DarkSlateBlue,5x7 in
587,Eco Treadmill Smart,Film treatment learn daughter few reason issue.,Smartwatches,634,299,ForestGreen,Large
588,Charger Lamp,Add stand bit matter worker whatever.,Smartphones,440,496,DeepSkyBlue,100x200 mm
589,Rechargeable Thermostat Smart Advanced,But increase rest.,Laptops & Computers,915,657,Magenta,XS
590,Eco Router Lamp Rechargeable,Street task buy.,Women's Clothing,403,759,Coral,S
591,Portable Tablet 360,Outside fact week voice act thousand.,Team Sports,897,819,RoyalBlue,8x10 in
592,Wireless Toaster Scanner Automatic Edge Sense,Particular myself traditional people.,Sports & Outdoors,396,64,Moccasin,30x40 cm
593,Premium Drone,Wind phone report student field.,Camping & Hiking,942,427,Plum,M
594,Smart Mouse Max Clean,Oil take country model add.,Fishing & Hunting,14,747,DeepSkyBlue,5x7 in
595,Lamp,I resource trouble share law police state.,Clothing & Apparel,366,584,Olive,L
596,Smart Mouse,Interview body picture produce reason allow policy.,Beauty & Personal Care,521,325,MediumSpringGreen,12x18 in
597,Premium Lock,Into their high to economy worry.,Grooming Tools,916,346,PapayaWhip,XL
598,Advanced Light Air Compact,Image participant without thousand bit turn eight.,Clothing & Apparel,172,70,MediumSeaGreen,30x40 cm
599,Ultra Tablet Blender Clean One,Cultural Mrs return.,Clothing & Apparel,277,688,Linen,Small
600,Mini Drone Vacuum Pro Air,Player perhaps special range sea.,Cycling,300,39,Purple,Large
601,Mini Fan Speaker Fridge Premium Air Portable,Million member walk stand effort.,Headphones & Earbuds,965,153,Ivory,10x10 cm
602,Pro Powerbank Radio 360 Max,Those yeah before defense.,Smartwatches,177,676,DarkBlue,8x10 in
603,Wireless Scooter Microphone,Sell source own arrive information.,Sports & Outdoors,1,258,Gainsboro,Medium
604,Mixer,Summer suggest exactly economic cold student feeling.,Clothing & Apparel,616,485,BlueViolet,Medium
605,Silent Clock Lock,Remember training western space whatever couple.,Beauty & Personal Care,327,137,PaleVioletRed,Medium
606,Silent Lamp Lamp Kettle,Above top soon.,Cycling,233,33,Orange,XL
607,Ultra Thermostat Stove Lamp Premium Touch Digital,Anything her name speech.,Fragrances,499,637,IndianRed,12x18 in
608,Smart Scanner Shaver Powerbank Portable,Article civil total audience.,Men's Clothing,207,2,Coral,10x10 cm
609,Advanced Radio Light Fan 360,Manage race serve walk of.,"Accessories (Bags, Hats, Belts)",186,730,Gray,30x40 cm
610,Smart Clock Plus Touch,Special age realize federal.,Grooming Tools,769,191,HotPink,XL
611,Ultra Drone,Former fish happy choice minute.,Camping & Hiking,731,783,Crimson,XXL
612,Smart Trimmer Clock Touch,Finish despite institution data drug.,Women's Clothing,993,655,DarkCyan,5x7 in
613,Pro Shaver Thermostat,Personal voice expect room news town interesting.,Team Sports,402,278,MediumSlateBlue,Large
614,Premium Fan Prime 360,Page continue city represent.,Automotive,456,897,FireBrick,30x40 cm
615,Camera Drone Fan,Want single act herself country either family.,Books & Stationery,18,434,Fuchsia,Extra Large
616,Smart Fan Speaker Fridge Silent,Answer against could focus far the possible.,Men's Clothing,821,45,Lavender,10x10 cm
617,Fast Webcam Projector Lock,Special various consider rule animal their threat.,Kids' Clothing,663,404,LightSkyBlue,XL
618,Silent Scanner Tablet Radio 360 Advanced,Goal arm town business season sort cost.,Smartphones,701,497,Indigo,L
619,Wireless Tablet Blender,If blood probably send able.,Sports & Outdoors,991,43,Violet,100x200 mm
620,Portable Webcam Bicycle Camera Advanced Advanced,Dinner early pull yard whole information TV.,Automotive,390,247,DarkSlateBlue,5x7 in
621,Ultra Dock Go Touch,Trouble step mission fire.,Home & Kitchen,413,441,Navy,Extra Large
622,Clean Scooter Compact Max,Marriage relate girl green computer suffer me.,Sports & Outdoors,476,431,Sienna,8x10 in
623,Rechargeable Fridge Freezer Air,Nearly do and company dinner bad especially.,Cameras & Accessories,57,20,LightSlateGray,100x200 mm
624,Digital Thermostat Microphone Scooter One Smart Pro,Current boy professional clear suffer professional.,Women's Clothing,473,923,MediumSeaGreen,Extra Large
625,Rechargeable Projector,Court sometimes ask child.,Headphones & Earbuds,285,609,SlateGray,5x7 in
626,Drone,Scene especially new without.,Home & Kitchen,852,389,Violet,XXL
627,Ultra Bicycle Clock Lamp Air,Attorney recent time final which.,Makeup,762,697,DarkBlue,Medium
628,Mini Fan Speaker Fridge Automatic Smart Go,Bit near front hard woman.,Cameras & Accessories,147,163,HoneyDew,Extra Large
629,Ultra Brush Cooler Powerbank Edge Lite Smart,Deal foot movie city.,Sports & Outdoors,585,434,Brown,8x10 in
630,Portable Grill Trimmer,Design I between choose fund forget.,Smartwatches,365,607,DarkMagenta,Small
631,Mixer,Sport forget different choice hard.,Furniture,698,270,DarkViolet,15x20 cm
632,Eco Heater Edge Portable,Member simple leader.,Smartphones,979,823,SpringGreen,10x10 cm
633,Advanced Headphones Go,Production brother once the employee eat story.,Skincare,367,369,Cyan,Medium
634,Compact Tablet Speaker Scooter Plus Touch,Edge difficult more social strategy so new.,Clothing & Apparel,253,883,Moccasin,S
635,Eco Grill Phone Mini Plus,Moment represent wide customer cover whose.,Smartwatches,456,40,LemonChiffon,8x10 in
636,Fast Radio Iron Go Eco Pro,Task coach fund either.,Team Sports,994,780,SkyBlue,XL
637,Pro Radio Radio Sense 360 Prime,Claim last mission change.,Fitness Equipment,964,71,LightPink,12x18 in
638,Treadmill,Exist evening both budget relate course word ball.,Cleaning Supplies,374,142,LightSkyBlue,Medium
639,Wireless Lamp Freezer,Open claim reflect environment scene central.,Shoes & Footwear,980,630,SteelBlue,Extra Large
640,Ultra Toaster Air Automatic,Wide south trip less air lose.,Automotive,34,551,SaddleBrown,XS
641,Silent Webcam Cooker Toaster,Town purpose poor data able head.,Smartwatches,521,373,DarkCyan,8x10 in
642,Clean Headphones,Focus different maintain arrive consumer because.,Kitchen Appliances,813,584,NavajoWhite,5x7 in
643,Digital Speakerphone Stove Tablet,Friend attorney million agree station.,Kitchen Appliances,599,820,Wheat,Medium
644,Silent Mouse Monitor Phone Max,Kid society food.,Cleaning Supplies,116,923,CadetBlue,30x40 cm
645,Silent Speakerphone Oven Advanced Go,World nothing data century heart which.,Books & Stationery,450,650,Snow,S
646,Blender,Far him agency there real.,Kids' Clothing,908,51,DarkOrchid,XXL
647,Portable Stove Monitor Tablet Compact Max Premium,New hear money reflect cost white.,Automotive,139,326,SpringGreen,5x7 in
648,Ultra Fan Fast Smart,Deal board career economy none such should.,Shoes & Footwear,352,439,IndianRed,10x10 cm
649,Camera Bicycle Speakerphone,Front way certain successful learn.,Cleaning Supplies,72,148,DarkGreen,100x200 mm
650,Router Freezer Webcam,Occur wish huge these woman keep quality.,Sports & Outdoors,665,77,PapayaWhip,10x10 cm
651,Fast Iron Microphone Edge Clean Digital,Job not old record.,Team Sports,858,453,SandyBrown,100x200 mm
652,Automatic Projector One,Employee whatever section fish.,Clothing & Apparel,174,151,BlanchedAlmond,L
653,Wireless Bicycle Sense,Rise think call market read.,Fitness Equipment,761,126,GhostWhite,XXL
654,Fast Powerbank Projector Advanced 360 Rechargeable,Foot better its identify here.,Books & Stationery,627,647,SeaGreen,30x40 cm
655,Fan Cooler Vacuum,City player try picture its build no appear.,Health & Wellness,943,181,Thistle,50x70 cm
656,Wireless Brush Blender Vacuum,Cause television international include law nor most.,Toys & Games,406,400,DarkGray,Medium
657,Fast Powerbank Brush Charger Sense,Ahead fund stuff on blue.,Smartwatches,544,619,SandyBrown,M
658,Digital Cooker Cooler,Course why seek teach unit provide us.,Grooming Tools,990,78,PapayaWhip,XXL
659,Rechargeable Radio Mixer Smart,Right year a mean later.,Headphones & Earbuds,561,868,MediumPurple,5x7 in
660,Automatic Lamp Scanner Vacuum,First show field store strategy.,Fitness Equipment,839,521,MintCream,M
661,Clean Camera Premium Edge,Discussion arm drug.,Sports & Outdoors,520,711,Fuchsia,8x10 in
662,Digital Speakerphone Go,Indicate change lawyer benefit project.,Home Decor,168,64,MediumBlue,5x7 in
663,Shaver Thermostat,Wall reflect upon hundred song.,Bedding & Bath,208,678,Tan,8x10 in
664,Ultra Mixer Freezer Trimmer,Bag possible any better.,Women's Clothing,703,897,Coral,12x18 in
665,Compact Blender Cooker Smart Go Go,Somebody early whether thus seat.,Fragrances,764,143,WhiteSmoke,XXL
666,Stove,Indeed rate tree form.,Kitchen Appliances,896,426,PaleTurquoise,5x7 in
667,Lock,It top fear poor senior miss economy.,Clothing & Apparel,601,812,Ivory,12x18 in
668,Fast Webcam Webcam Treadmill,Person course loss deal we best special old.,Office Supplies,588,510,LawnGreen,Medium
669,Rechargeable Printer Compact Eco,Radio final history challenge painting similar ok.,Cycling,464,392,Orange,Small
670,Clean Light Ultra Air Smart,Way hit history it program.,Cycling,277,921,LightBlue,8x10 in
671,Mini Lamp Blender Drone Advanced Prime Silent,Light again national small.,Sports & Outdoors,291,783,SlateGray,Small
672,Mini Phone Thermostat Prime Eco Advanced,His ability office something scene.,Books & Stationery,460,607,Ivory,Medium
673,Clean Fan Iron Clock Advanced Mini Fast,With out apply follow customer reason lose.,Men's Clothing,293,197,LightSkyBlue,50x70 cm
674,Eco Webcam Cooker Toaster,Next thing true book including suddenly defense ready.,"Accessories (Bags, Hats, Belts)",431,862,Aquamarine,12x18 in
675,Wireless Thermostat Printer,Show score life pattern clear over pattern director.,Cameras & Accessories,350,682,Peru,S
676,Mini Powerbank,Science stage particularly east break.,Skincare,256,260,LightBlue,L
677,Ultra Powerbank Cooker Iron 360 360,Officer leg range.,Fishing & Hunting,300,697,Moccasin,XS
678,Smart Fan,President those let trouble party.,Office Supplies,39,698,LightCyan,L
679,Lock,Fact thought along pattern crime left.,Laptops & Computers,372,442,YellowGreen,XS
680,Camera,Investment threat message.,Skincare,718,310,Azure,15x20 cm
681,Automatic Clock Smart,Evening identify shake position.,Headphones & Earbuds,190,523,Silver,L
682,Drone,Wall open bar huge after.,Fishing & Hunting,331,153,LemonChiffon,10x10 cm
683,Smart Keyboard Ultra,Sport election sell front.,Men's Clothing,342,620,HoneyDew,M
684,Eco Printer Charger Brush,Organization together point week.,Shoes & Footwear,774,267,Gray,30x40 cm
685,Automatic Dock,Among prepare resource evidence test no big.,Laptops & Computers,4,134,BlanchedAlmond,Extra Large
686,Digital Microphone Cooler Prime Smart,Section according lead service sort young.,Cameras & Accessories,957,203,DeepPink,50x70 cm
687,Mini Kettle,Second too benefit answer understand myself big.,Kids' Clothing,243,934,LightYellow,100x200 mm
688,Wireless Brush Blender Vacuum,Sing church most yet.,Women's Clothing,266,926,HoneyDew,100x200 mm
689,Watch Tablet Printer,Cultural skin describe morning nearly air.,Skincare,78,217,LightYellow,50x70 cm
690,Advanced Scale Toaster Plus,Girl beyond light situation.,Beauty & Personal Care,452,413,MediumSeaGreen,Extra Large
691,Digital Vacuum Touch Rechargeable Compact,Worker none magazine against once.,Home & Kitchen,580,346,DarkBlue,XS
692,Lock,Send decide your next whether easy.,Toys & Games,927,316,PaleVioletRed,8x10 in
693,Pro Microphone Cooler Automatic Clean Mini,Benefit card over need wide western television lay.,Smartwatches,509,65,DarkKhaki,M
694,Premium Charger Lamp Digital,Yet human step often every half travel.,Office Supplies,786,440,LawnGreen,S
695,Silent Webcam Dock Heater Sense,Start ago rule toward operation than both value.,Fragrances,16,592,Orange,Large
696,Phone Iron Speakerphone,Factor scene garden receive recent moment inside.,Kids' Clothing,706,784,MediumTurquoise,12x18 in
697,Wireless Lock Thermostat Edge,Item six sign at ok candidate nation size.,Cycling,753,853,Sienna,Medium
698,Portable Scooter Rechargeable,Social good continue protect.,Fragrances,700,751,PaleTurquoise,XS
699,Automatic Projector Brush Go,Know direction compare goal year whole record.,Shoes & Footwear,275,261,GoldenRod,XL
700,Ultra Camera Keyboard Digital Air,At again ability.,Headphones & Earbuds,404,502,Chocolate,S
701,Microphone Cooler,Other allow none chair none town house.,Toys & Games,81,85,Beige,Extra Large
702,Fast Shaver Max Air,Door record information her peace style attack.,Books & Stationery,630,872,MidnightBlue,S
703,Heater,Need standard help national black from voice ever.,Headphones & Earbuds,934,9,LemonChiffon,100x200 mm
704,Lamp Lamp Kettle,Always sign significant evidence he eye.,Clothing & Apparel,364,695,DarkOrchid,100x200 mm
705,Pro Printer Fan,Include enter land Democrat general some not admit.,Books & Stationery,261,640,LightCyan,12x18 in
706,Kettle Vacuum,Hear program same another office animal smile.,Beauty & Personal Care,918,816,Thistle,30x40 cm
707,Pro Dock Freezer Projector Sense,Particular economy lay.,Cameras & Accessories,282,959,DarkCyan,M
708,Advanced Router Wireless Digital Eco,Attack place out organization remember.,Cleaning Supplies,384,526,Lavender,XS
709,Advanced Brush Scale Grill,Line wide peace model may.,Books & Stationery,906,278,HotPink,30x40 cm
710,Mini Headphones Compact Advanced,International serve main soon notice guy.,Kids' Clothing,398,563,Khaki,S
711,Automatic Radio Treadmill Silent,Politics big protect itself mind.,Home Decor,805,905,MediumAquaMarine,Large
712,Eco Tablet Blender Clean,Off quite subject ahead country.,Beauty & Personal Care,925,545,DarkGoldenRod,30x40 cm
713,Ultra Blender Sense,Political occur piece.,Furniture,28,366,Ivory,M
714,Rechargeable Grill Phone Go Edge,Wrong probably board analysis central capital film southern.,Kitchen Appliances,884,425,LightYellow,30x40 cm
715,Automatic Radio,Blue stuff animal describe trouble.,Fragrances,540,745,AliceBlue,8x10 in
716,Portable Scanner Shaver Powerbank Ultra,Institution not couple home.,Home Decor,935,516,OliveDrab,50x70 cm
