Index,Name,Description,Category,Price,Stock,Color,Size
717,Silent Freezer Projector Webcam Go,Public wrong culture name price sometimes.,Team Sports,828,272,Red,Extra Large
718,Smart Fan Powerbank Air Portable 360,Piece fund see character per fact conference positive.,Cycling,413,595,MediumPurple,10x10 cm
719,Grill Tablet Fridge,Foot collection finally tonight.,Makeup,761,46,MediumVioletRed,L
720,Dock Freezer Projector,Marriage four feeling adult health.,Health & Wellness,264,262,DarkSlateBlue,Extra Large
721,Clean Radio,Product bill peace seek company.,Automotive,295,88,AntiqueWhite,10x10 cm
722,Printer,Itself major consumer choose keep painting system.,Clothing & Apparel,203,506,Maroon,5x7 in
723,Advanced Fridge Cooker Pro Digital Prime,Foot ahead lead week this.,Home & Kitchen,29,523,Tan,XL
724,Smart Vacuum Cooler Prime,Not eat good miss either.,Smartwatches,179,547,Thistle,12x18 in
725,Portable Speakerphone X,Risk eat into find.,Fragrances,328,539,SkyBlue,XXL
726,Smart Freezer Projector Webcam One Premium One,Second sound know since hear return today part.,Fishing & Hunting,759,577,Peru,M
727,Mini Stove Iron,Occur glass toward least those eat response.,Home & Kitchen,614,894,Orchid,S
728,Portable Tablet,Congress most born follow room that pretty public.,Headphones & Earbuds,149,121,Moccasin,12x18 in
729,Clean Drone Heater Scanner Plus,Happy think star follow could recent care.,Sports & Outdoors,926,223,MintCream,50x70 cm
730,Digital Blender Treadmill Tablet Wireless Plus,Program story cause.,"Accessories (Bags, Hats, Belts)",690,462,Indigo,8x10 in
731,Pro Drone Advanced Lite,Year seat every son force who respond.,Kids' Clothing,969,395,PowderBlue,5x7 in
732,Ultra Blender Toaster Camera Ultra,Structure difficult keep surface analysis early win sound.,Beauty & Personal Care,994,349,Coral,XXL
733,Rechargeable Thermostat Printer Sense Max Sense,Choose mother success try.,Makeup,748,127,PaleVioletRed,12x18 in
734,Router Freezer Webcam,Enjoy yes wear road.,Men's Clothing,7,910,MediumOrchid,Large
735,Smart Mouse Smart Portable,Side rock interesting throw owner create off become.,Books & Stationery,534,37,BlueViolet,XL
736,Smart Freezer,Bed maybe finish kid action environmental site check.,Headphones & Earbuds,174,881,Pink,10x10 cm
737,Projector,Determine those quite card along.,Grooming Tools,435,525,Pink,12x18 in
738,Drone,Fire page nearly case.,Shoes & Footwear,390,652,DarkKhaki,XXL
739,Ultra Fan Phone One,Theory idea week section dog system.,Beauty & Personal Care,902,94,LightSlateGray,100x200 mm
740,Eco Trimmer Cooler,Page among speech clear relate skill serious soon.,Skincare,975,491,OldLace,8x10 in
741,Premium Clock Drone Charger,Reveal already next customer region reality.,Fishing & Hunting,131,85,Orchid,15x20 cm
742,Premium Scooter Microphone Max,Happy front production hold note.,Health & Wellness,907,214,Gold,8x10 in
743,Digital Iron Cooler Iron One Touch,Majority ok find.,"Accessories (Bags, Hats, Belts)",436,327,DarkSeaGreen,Large
744,Smart Heater Go Smart,Scientist join realize level could letter.,Books & Stationery,715,74,LightBlue,5x7 in
745,Premium Brush,Put apply state peace.,Books & Stationery,30,381,MistyRose,12x18 in
746,Smart Printer Freezer Advanced,Thus house treatment run event this level everybody.,Toys & Games,761,389,LightSalmon,10x10 cm
747,Scale Clock,Politics effect difficult he guy.,Fishing & Hunting,186,781,MediumBlue,30x40 cm
748,Silent Fan Digital Smart,Suggest hard on.,Smartwatches,729,803,LightSlateGray,S
749,Fast Brush Touch Fast,Require show them treat tend through.,Fragrances,256,477,Navy,Small
750,Silent Charger Lock Oven,Available lose recognize she.,Automotive,709,812,BlueViolet,10x10 cm
751,Advanced Stove Light,Through land court reveal.,Makeup,219,149,Cornsilk,5x7 in
752,Smart Vacuum Plus Lite Clean,Similar yes suddenly organization have season.,Home & Kitchen,451,257,DarkOrange,L
753,Clean Mixer Toaster Toaster,Standard institution easy push knowledge area.,Men's Clothing,778,92,LemonChiffon,12x18 in
754,Smart Iron Microphone,Talk deep religious wrong until effect.,Skincare,133,706,Azure,15x20 cm
755,Fast Trimmer Clock Mini Premium,Main season media rest instead in.,Health & Wellness,94,21,Lime,100x200 mm
756,Lamp,Someone Mr modern mission something great.,Home Decor,312,722,DarkViolet,10x10 cm
757,Portable Kettle Digital Go,Television amount final country turn reach deep report.,Shoes & Footwear,978,351,PeachPuff,L
758,Smart Heater Keyboard,Party try short everything.,Kitchen Appliances,737,71,BurlyWood,Large
759,Fan Phone,Common Mr skill shake.,Automotive,874,542,Chocolate,Large
760,Microphone,Together begin manager position education four difficult agency.,Camping & Hiking,194,995,MediumAquaMarine,XXL
761,Portable Fan,Party record television leg morning.,Books & Stationery,437,208,Green,50x70 cm
762,Ultra Thermostat Stove Lamp,Mrs success follow or magazine.,Beauty & Personal Care,758,426,SteelBlue,L
763,Rechargeable Headphones Portable Wireless,Toward manager week hope.,Home & Kitchen,330,968,MediumSlateBlue,Large
764,Rechargeable Fan Scooter Trimmer Sense,It perhaps young gas child enjoy.,Office Supplies,437,812,Aqua,XS
765,Digital Toaster Scanner Fast Edge Portable,Chance move single project anything medical concern somebody.,Headphones & Earbuds,160,675,DarkViolet,XXL
766,Clean Kettle Portable One,Resource establish team service.,Skincare,338,835,DeepPink,S
767,Silent Thermostat Drone Heater,Too house after benefit responsibility.,Kids' Clothing,835,361,IndianRed,Large
768,Toaster Clock Monitor,Watch tend design son condition chair opportunity.,Skincare,787,252,Violet,50x70 cm
769,Advanced Headphones Charger X Fast,Drug use admit seem similar key.,Furniture,748,419,Turquoise,15x20 cm
770,Eco Brush Edge,Lawyer lose radio mind agree.,Smartwatches,339,379,Linen,Medium
771,Compact Scanner Tablet Radio Clean Plus Sense,Indeed future wear staff police its produce stop.,Smartphones,349,582,RoyalBlue,Small
772,Trimmer Stove,For eat success traditional.,Home Decor,434,155,MistyRose,S
773,Automatic Monitor Brush Monitor 360 Lite,Player study watch situation blue.,Cleaning Supplies,228,816,Wheat,8x10 in
774,Ultra Bicycle Microphone,Race believe event term year physical might.,Makeup,532,823,Olive,L
775,Projector,Move sometimes likely live.,Beauty & Personal Care,625,950,DarkOrange,5x7 in
776,Mini Grill Grill Scale Max Premium,Maintain its evidence best third.,Team Sports,604,781,Red,XS
777,Eco Headphones Premium,Happen middle nearly design value.,Shoes & Footwear,882,106,MistyRose,5x7 in
778,Fast Fan Monitor Toaster Pro Rechargeable Edge,Check plant though local pay build mind.,Kitchen Appliances,237,510,Turquoise,L
779,Wireless Iron Thermostat Premium Eco,Yet indicate have skill training.,Fitness Equipment,567,68,Sienna,8x10 in
780,Premium Router Sense Digital 360,Cold mention final.,Men's Clothing,600,77,SpringGreen,5x7 in
781,Automatic Radio Mixer X,Mr official three player science case young successful.,Skincare,625,732,Aquamarine,M
782,Mini Grill Phone Smart Mini,Skill poor during heart.,Fragrances,565,994,SeaGreen,XXL
783,Silent Watch Tablet Printer X Digital Max,Everyone white card also outside.,Kids' Clothing,292,52,MediumSpringGreen,S
784,Smart Freezer One,Radio still thought anything nor.,Haircare,273,190,Plum,XL
785,Clean Dock Edge,Gas save behavior past.,Home Decor,970,709,OrangeRed,S
786,Tablet,Until heavy factor manager question heart amount.,Grooming Tools,347,243,LightSlateGray,5x7 in
787,Smart Speakerphone Smart Eco,Yard food involve he teach.,"Accessories (Bags, Hats, Belts)",14,521,GhostWhite,Large
788,Smart Keyboard Portable Touch,Financial turn significant leave phone heavy beyond.,Grooming Tools,589,706,MediumSeaGreen,30x40 cm
789,Scanner Tablet Radio,Student once brother compare.,Kitchen Appliances,292,764,Beige,Medium
790,Pro Tablet,Common green life hair six.,Haircare,505,334,Black,S
791,Advanced Radio Bicycle Cooler,Media rate official wall hot million control.,Camping & Hiking,555,190,RosyBrown,S
792,Eco Scooter Scale Cooler Sense Air Clean,Doctor pass collection arm factor choice hit.,Fishing & Hunting,400,363,LavenderBlush,15x20 cm
793,Rechargeable Scooter Scale Cooler Automatic Plus 360,Past share left show skin piece scientist PM.,Cameras & Accessories,505,799,DarkGray,5x7 in
794,Iron Toaster Projector,Like rate wrong thing that.,Clothing & Apparel,61,474,SlateBlue,5x7 in
795,Keyboard,Evening art action writer work perform practice enjoy.,Cameras & Accessories,298,292,Gainsboro,50x70 cm
796,Mini Drone Heater Scanner One Wireless,Security life present according thing site.,Fishing & Hunting,234,258,Lavender,10x10 cm
797,Mini Lock Camera,Large son statement turn.,Camping & Hiking,171,731,LemonChiffon,8x10 in
798,Smart Dock Ultra,Strategy usually talk rate structure receive.,Women's Clothing,528,565,LightSlateGray,Medium
799,Fridge Mouse Monitor,Ever music evidence.,Cleaning Supplies,46,587,GhostWhite,XS
800,Premium Shaver Premium Premium Fast,Right simply blood.,Cleaning Supplies,482,614,NavajoWhite,Extra Large
801,Portable Watch Portable Edge,Describe condition possible realize be fine Mr.,Laptops & Computers,47,91,AntiqueWhite,XL
802,Printer,Charge different west majority huge reflect medical.,Sports & Outdoors,135,135,HotPink,Medium
803,Digital Fan Iron Cooker,With box world coach.,Team Sports,128,273,PaleGreen,8x10 in
804,Silent Router Scanner Max Touch,Amount somebody itself able politics.,Home Decor,22,463,Aquamarine,5x7 in
805,Portable Headphones Fast Smart Touch,Join training final say civil tree dream.,Team Sports,525,585,BurlyWood,XXL
806,Mini Treadmill X X,Avoid trial sea.,Headphones & Earbuds,51,699,Cyan,M
807,Digital Heater Mixer Shaver,Sing training everything moment administration have effect.,Office Supplies,679,983,LightSlateGray,5x7 in
808,Digital Cooler Lite,Thank raise find art school thousand purpose serious.,Kitchen Appliances,957,306,Aqua,8x10 in
809,Rechargeable Cooker Ultra Silent,Loss business reduce interesting people early boy boy.,Furniture,840,740,MistyRose,15x20 cm
810,Printer,Instead skin write management over protect live rule.,Books & Stationery,652,969,LawnGreen,30x40 cm
811,Scale Toaster,Raise student perhaps other morning maintain.,Office Supplies,792,688,BurlyWood,Large
812,Premium Kettle Silent Advanced,Someone single activity official.,Smartphones,216,943,Cornsilk,XS
813,Fan Cooler Vacuum,Let agreement marriage type front performance radio.,Haircare,259,517,OldLace,10x10 cm
814,Blender,Large write line two.,Skincare,866,617,CornflowerBlue,Small
815,Wireless Light Eco Portable,You development research perhaps themselves.,Makeup,186,549,WhiteSmoke,30x40 cm
816,Smart Heater Thermostat,Rise herself religious time care certainly history fish.,Men's Clothing,1,634,MediumSlateBlue,Large
817,Scooter,Book report accept at behavior along.,Automotive,103,660,DarkSeaGreen,8x10 in
818,Headphones,Prepare show play drive hear American training.,Books & Stationery,433,468,White,8x10 in
819,Blender Toaster Camera,Recognize stage four art.,Books & Stationery,915,997,DarkGoldenRod,8x10 in
820,Portable Radio Bicycle Cooler,The about court left soon new.,Makeup,550,663,MintCream,Medium
821,Pro Oven,Analysis foreign the blue ball along senior think.,Women's Clothing,255,985,MediumSpringGreen,50x70 cm
822,Mixer,Operation participant great ever.,Makeup,896,66,LightYellow,L
823,Portable Microphone Camera Eco,Meeting about hour thus.,Home Decor,537,915,LightSeaGreen,Large
824,Silent Camera Heater Webcam One Silent Smart,Best for good still into people green staff.,Camping & Hiking,362,607,HotPink,S
825,Compact Vacuum Shaver,Prevent sometimes interesting tend in through.,Home & Kitchen,801,157,MidnightBlue,S
826,Mini Webcam Scooter Compact,Effort increase argue protect white later.,Team Sports,776,53,MistyRose,S
827,Smart Speakerphone 360,Drop vote level ask social rule.,Cleaning Supplies,400,289,PaleVioletRed,XL
828,Advanced Kettle Brush Fan,Message international office shoulder note allow thus particular.,Sports & Outdoors,179,301,Khaki,XXL
829,Automatic Scanner Monitor Treadmill Prime X Pro,Crime condition check.,Home & Kitchen,506,897,RosyBrown,XS
830,Grill Brush Watch,Bed sort cause how hard behind as.,Men's Clothing,930,240,SpringGreen,Extra Large
831,Smart Heater Clean Rechargeable Smart,Rich more you training institution general.,Team Sports,612,659,PeachPuff,10x10 cm
832,Premium Blender Automatic Air,Water too part put five.,Clothing & Apparel,351,246,GreenYellow,XL
833,Grill,Center feel blood.,Smartwatches,163,975,LawnGreen,15x20 cm
834,Mini Radio Stove Shaver,Example sound near fill pretty increase court.,"Accessories (Bags, Hats, Belts)",276,408,Crimson,15x20 cm
835,Wireless Lock One,Early maybe when crime describe a.,Home Decor,887,114,PowderBlue,100x200 mm
836,Ultra Keyboard Toaster Monitor X,Surface at throughout start sport.,Skincare,720,214,LightPink,15x20 cm
837,Dock Speaker Phone,Pm against news ask suffer idea.,Grooming Tools,357,479,DarkGray,XXL
838,Smart Projector Mini,Hand political popular probably dinner toward current.,Haircare,274,401,DarkOrchid,M
839,Smart Radio Bicycle Cooler,Public coach put change.,Men's Clothing,856,432,Navy,Extra Large
840,Mini Webcam Projector Lock Smart Prime,Visit whose use federal.,Cycling,130,166,FireBrick,M
841,Premium Mouse Mouse Router Advanced One Air,Fear approach serve every institution but.,Cycling,484,590,Beige,10x10 cm
842,Shaver,Scene collection truth find could order relate.,Smartphones,763,294,Cornsilk,10x10 cm
843,Rechargeable Fan Pro,Whose education any consider capital.,Kitchen Appliances,114,387,LightGreen,Extra Large
844,Compact Fan Clock Camera Plus Sense,Employee lead identify indicate be drug.,Fragrances,84,42,Tomato,L
845,Rechargeable Phone Automatic Sense Wireless,Public hair by son.,Bedding & Bath,545,169,Cornsilk,Extra Large
846,Advanced Printer Fan Shaver Compact Touch Clean,Good likely speak up.,Office Supplies,519,427,PowderBlue,12x18 in
847,Compact Iron Drone Portable,People avoid whether cell even.,Health & Wellness,964,572,FloralWhite,S
848,Oven,There week myself fall bar image not.,Furniture,578,931,Bisque,M
849,Compact Brush,Year during spring draw.,Kids' Clothing,41,802,LightSeaGreen,L
850,Charger,Story free type lay oil.,Headphones & Earbuds,971,831,Silver,10x10 cm
851,Freezer Phone,Sing mouth recent high time.,Shoes & Footwear,622,940,DarkBlue,15x20 cm
852,Smart Keyboard Plus,Safe special court receive.,Fitness Equipment,606,444,Pink,8x10 in
853,Freezer Mixer Lock,Performance together religious bed.,Smartwatches,766,4,Chartreuse,50x70 cm
854,Portable Mixer Lamp Automatic,Message big hair.,Cycling,305,31,Coral,100x200 mm
855,Pro Oven Mouse Cooler Go,Similar visit never notice.,Cleaning Supplies,140,140,PeachPuff,15x20 cm
856,Smart Vacuum X,Or middle almost concern stop.,Clothing & Apparel,518,713,LightCoral,5x7 in
857,Compact Camera Bicycle Speakerphone,Year security fish probably offer husband.,Smartwatches,922,769,DarkSlateBlue,XS
858,Mini Lamp Speakerphone Headphones Automatic Compact Ultra,Common network you office low huge.,Makeup,921,195,Brown,100x200 mm
859,Blender Cooker,Get who after the successful occur.,Fishing & Hunting,908,868,MediumSlateBlue,12x18 in
860,Digital Camera Rechargeable Sense Digital,Explain require Mr.,Books & Stationery,97,456,DeepPink,10x10 cm
861,Silent Iron Rechargeable Fast Plus,Or school quite read sport.,Cameras & Accessories,662,637,DarkGray,50x70 cm
862,Portable Drone Portable,Election argue manager give.,Skincare,451,258,SaddleBrown,50x70 cm
863,Charger Lamp,Lose son personal prepare.,Health & Wellness,940,495,Cornsilk,100x200 mm
864,Premium Router,Management job never ago piece wind.,Haircare,291,85,SaddleBrown,Extra Large
865,Wireless Toaster,Big training along item officer.,Shoes & Footwear,990,921,Sienna,8x10 in
866,Advanced Fan Cooler Vacuum Smart,Prevent its good unit ball official loss.,Clothing & Apparel,766,154,SteelBlue,XXL
867,Portable Printer Charger Brush 360,Almost affect practice its herself personal.,Furniture,622,408,Chocolate,Small
868,Compact Printer Charger Brush Fast,At throughout know difference.,Home Decor,646,904,MediumSlateBlue,Large
869,Advanced Scanner Keyboard Monitor Premium,Well interview especially drop task.,Health & Wellness,336,79,RoyalBlue,30x40 cm
870,Smart Mixer Vacuum,Feeling radio call international science themselves particular.,Cameras & Accessories,184,925,LightSteelBlue,M
871,Rechargeable Projector,Simple big science often surface at.,Office Supplies,43,833,Brown,5x7 in
872,Lock Charger,Deep rock impact specific book radio individual travel.,Beauty & Personal Care,284,152,SaddleBrown,100x200 mm
873,Rechargeable Router Lamp Compact Eco Plus,Road language pressure chance consider picture yet.,Fishing & Hunting,889,801,PaleGoldenRod,50x70 cm
874,Smart Fridge Camera Mini,Common outside executive tax once audience.,Office Supplies,827,634,SlateBlue,Small
875,Automatic Cooker Cooler Edge Advanced,Might federal different and personal move.,Skincare,223,414,Ivory,M
876,Silent Drone Thermostat Headphones,Prepare inside decade moment sport focus.,Smartwatches,223,169,Turquoise,10x10 cm
877,Premium Scooter Eco Fast,Watch every view prepare.,Grooming Tools,471,815,SteelBlue,100x200 mm
878,Portable Keyboard Silent Fast,Fire score various your certainly almost bill.,Books & Stationery,896,39,Navy,30x40 cm
879,Advanced Tablet Cooler Fridge Plus Smart Mini,Decide world Republican cost cultural send pass.,Health & Wellness,523,942,BlanchedAlmond,Large
880,Smart Brush Fridge Drone Smart,East through magazine eye clear.,Office Supplies,893,916,Tomato,XL
881,Digital Mixer Treadmill Sense Touch Edge,Toward certainly along one role hair.,Home Decor,803,616,SteelBlue,100x200 mm
882,Wireless Router Freezer Webcam Rechargeable,Attention lose late accept why day buy.,Furniture,673,941,DarkOrange,Large
883,Advanced Fan Cooler Vacuum,Long baby hand around force voice might.,Team Sports,568,624,Blue,L
884,Eco Thermostat Oven Advanced Edge,Thought follow talk able accept watch.,Furniture,346,930,PaleTurquoise,12x18 in
885,Lamp Grill,Receive both interest teach sense rise.,"Accessories (Bags, Hats, Belts)",120,120,DarkTurquoise,Large
886,Pro Keyboard,Pay successful environmental already.,"Accessories (Bags, Hats, Belts)",587,534,SlateGray,100x200 mm
887,Portable Lock Charger,Difficult reach economy collection each.,Sports & Outdoors,311,434,Azure,Extra Large
888,Fast Thermostat Drone Heater Plus One,Serve quite now class sure culture view.,Team Sports,625,420,Magenta,Medium
889,Rechargeable Watch,Stage represent create moment activity.,Fragrances,976,995,Crimson,12x18 in
890,Oven Trimmer,Child hot drive growth suggest group big.,Fitness Equipment,984,168,MistyRose,8x10 in
891,Automatic Cooler Printer Speaker,Base local successful daughter yeah mouth.,Laptops & Computers,288,524,Green,Small
892,Smart Light Premium Compact Premium,Lead organization at blood religious matter catch represent.,Cycling,230,844,LightBlue,Medium
893,Blender Toaster Camera,School there exist before probably might.,Fishing & Hunting,786,204,PaleVioletRed,30x40 cm
894,Smart Mouse Lamp Pro,Event agreement network future thing hot help.,Beauty & Personal Care,735,797,LemonChiffon,Large
895,Advanced Webcam Projector Oven,Tough whether shake as which industry standard.,Kids' Clothing,507,890,DarkGoldenRod,Extra Large
896,Projector Speaker Treadmill,Run few society available agree ten.,Fishing & Hunting,991,446,Silver,12x18 in
897,Fast Fridge Cooker Max Fast,Toward word not tonight.,Beauty & Personal Care,883,827,DarkGoldenRod,XL
898,Ultra Phone Rechargeable Wireless Wireless,Probably everything analysis majority third.,Sports & Outdoors,310,829,LightPink,10x10 cm
899,Smart Drone Speaker Speaker Air Smart Clean,Camera feel seven next whether building wife yeah.,Grooming Tools,105,129,HoneyDew,XXL
900,Fast Webcam Projector Lock Rechargeable,Hit cover agree good story population.,Toys & Games,448,318,CornflowerBlue,30x40 cm
901,Pro Mixer Lamp Rechargeable,Serve market really operation should.,Cleaning Supplies,310,315,Chocolate,10x10 cm
902,Fast Printer Fan Shaver Sense One,East could also detail movie.,Beauty & Personal Care,999,965,DeepPink,Extra Large
903,Eco Fan Plus,Back arrive student common accept sit seat.,Camping & Hiking,127,963,Cornsilk,S
904,Wireless Mixer Vacuum Plus Eco,Spring step wide.,Men's Clothing,257,222,Lavender,L
905,Stove Iron,Everyone style man tend cover quality.,Shoes & Footwear,914,996,BlanchedAlmond,100x200 mm
906,Automatic Lock Thermostat Premium Clean Rechargeable,Piece why out peace because pull new.,Health & Wellness,890,747,Brown,12x18 in
907,Advanced Watch 360 Clean,Have always artist large writer.,Grooming Tools,11,381,DarkBlue,XXL
908,Premium Printer Wireless,With argue edge official skin claim.,Makeup,73,727,Sienna,Medium
909,Eco Lock,Policy head professor.,Clothing & Apparel,627,887,MediumPurple,XXL
910,Rechargeable Mixer Bicycle Fridge Pro,Expect machine economic candidate.,Smartwatches,372,523,LightGray,50x70 cm
911,Clock Lock,If structure well improve oil happy kid.,"Accessories (Bags, Hats, Belts)",54,459,RoyalBlue,50x70 cm
912,Silent Oven Smart,Development whom magazine foreign.,Smartwatches,37,968,Ivory,Small
913,Compact Mixer Lamp Digital Eco Eco,Loss available art.,Kitchen Appliances,603,879,DeepPink,15x20 cm
914,Fan Drone Monitor,Public age stand total someone get.,Grooming Tools,795,346,SteelBlue,S
915,Mini Fan Edge,Course opportunity evidence call.,Camping & Hiking,373,753,DarkGreen,XXL
916,Webcam Webcam Stove,Sport sit benefit hope.,Clothing & Apparel,893,933,SpringGreen,L
917,Smart Scooter Eco Eco Advanced,Mother late fire represent.,Camping & Hiking,108,723,Lime,100x200 mm
918,Fast Scooter Scale Cooler Prime Silent,Sometimes have international consider health kind on.,Headphones & Earbuds,77,453,DarkSlateBlue,Small
919,Portable Microphone Treadmill Oven Silent,Stop admit couple although.,Smartwatches,408,770,Brown,10x10 cm
920,Dock Dock Trimmer,Sign past key.,Cameras & Accessories,222,832,CadetBlue,Large
921,Radio Stove Shaver,Simple whether clear chance energy.,Automotive,392,27,Yellow,L
922,Scale,Force form pay happen close.,Camping & Hiking,812,397,Silver,100x200 mm
923,Ultra Speaker Tablet Headphones,Factor along security street for draw director easy.,Fishing & Hunting,152,717,LimeGreen,50x70 cm
924,Powerbank,Significant camera interesting toward baby them raise.,Office Supplies,112,125,LightSteelBlue,Small
925,Pro Mixer Drone Fan Fast,Baby week American foot bar.,Cleaning Supplies,892,538,MintCream,Extra Large
926,Rechargeable Lock,Mrs source law open painting front color.,Fishing & Hunting,555,402,SpringGreen,M
927,Advanced Phone Max Air 360,Traditional just positive identify loss truth need.,Fishing & Hunting,297,188,Aquamarine,S
928,Fast Cooler Treadmill Air Digital Portable,Music laugh sort course put southern worry.,Fragrances,979,979,Chartreuse,50x70 cm
929,Freezer Powerbank Watch,Network team social blue if face.,Grooming Tools,553,470,Chocolate,S
930,Ultra Vacuum Fan Edge,Movement moment appear term business occur.,Skincare,704,193,MediumBlue,10x10 cm
931,Stove Monitor Tablet,New deal magazine knowledge since position.,Grooming Tools,417,150,Thistle,10x10 cm
932,Pro Charger Monitor Brush,Plant enter newspaper end course how war.,Cameras & Accessories,627,297,AliceBlue,Small
933,Dock Speaker Phone,Because within politics rule usually later.,Grooming Tools,719,540,GreenYellow,XL
934,Clean Dock Eco Max,Board bag number charge word fly recognize.,Shoes & Footwear,810,283,Orchid,15x20 cm
935,Automatic Microphone Camera Edge Fast,Movie health appear the.,Bedding & Bath,256,697,Peru,15x20 cm
936,Compact Freezer Mixer,Member protect style exactly.,Kitchen Appliances,697,920,Linen,Small
937,Mini Bicycle Air Silent Fast,Effect statement establish both federal trial.,Fragrances,453,992,IndianRed,10x10 cm
938,Rechargeable Cooler Treadmill Wireless Go,If life personal technology.,Fragrances,498,521,HotPink,XL
939,Digital Dock Freezer Projector Mini One Mini,Per able voice.,Cycling,158,998,LightPink,8x10 in
940,Printer Lock Thermostat,End bed practice.,Home & Kitchen,658,85,Purple,100x200 mm
941,Smart Headphones Stove,Time allow beat seat whether bar foot.,Clothing & Apparel,456,371,LightSkyBlue,Large
942,Automatic Printer Webcam Touch Air,About door social shoulder edge only.,Smartwatches,237,871,DarkSeaGreen,Medium
943,Clean Vacuum Router Toaster Compact Sense,Produce learn job evening Republican message evening.,Fishing & Hunting,789,504,DarkOliveGreen,Small
944,Clean Webcam Toaster 360,Treatment much summer.,Furniture,189,417,Lavender,Small
945,Trimmer Webcam Heater,Rather financial animal would must war.,Kids' Clothing,319,964,LightGreen,30x40 cm
946,Clean Grill Grill Mini Mini,Out drop us.,Haircare,500,763,DarkViolet,L
947,Wireless Blender,Year might home environment himself usually.,Home & Kitchen,909,897,PaleVioletRed,8x10 in
948,Ultra Kettle Brush Fan Ultra Plus Rechargeable,Real over decision seek.,Smartphones,65,265,SpringGreen,M
949,Keyboard Freezer,Event fund occur also appear.,Sports & Outdoors,256,638,Black,15x20 cm
950,Premium Light Headphones Tablet,Full beyond near someone itself improve my home.,Automotive,310,318,PowderBlue,30x40 cm
951,Rechargeable Projector Air 360 Lite,Break everybody laugh director.,Grooming Tools,958,816,Cyan,L
952,Blender Blender,Far certainly enough sit window doctor teacher help.,Headphones & Earbuds,543,339,Cornsilk,Medium
953,Radio Iron,Several leader history pick team.,Home Decor,688,679,BurlyWood,S
954,Smart Monitor Brush Monitor Fast Premium,Effect enough interest better.,Camping & Hiking,74,456,ForestGreen,Large
